[{"id":"LKA.1_1","name":"Ampara","bounds":{"min":{"lng":80.9779,"lat":6.5126},"max":{"lng":81.8788,"lat":7.7392}},"geojson_properties":{"GID_1":"LKA.1_1","GID_0":"LKA","COUNTRY":"Sri Lanka","NAME_1":"Ampara","VARNAME_1":"Amparai","NL_NAME_1":"NA","TYPE_1":"Distrikkaya","ENGTYPE_1":"District","CC_1":"NA","HASC_1":"LK.AP","ISO_1":"NA"}},{"id":"LKA.2_1","name":"Anuradhapura","bounds":{"min":{"lng":79.9519,"lat":7.8151},"max":{"lng":80.9908,"lat":8.9206}},"geojson_properties":{"GID_1":"LKA.2_1","GID_0":"LKA","COUNTRY":"Sri Lanka","NAME_1":"Anuradhapura","VARNAME_1":"NA","NL_NAME_1":"NA","TYPE_1":"Distrikkaya","ENGTYPE_1":"District","CC_1":"NA","HASC_1":"LK.AD","ISO_1":"NA"}},{"id":"LKA.3_1","name":"Badulla","bounds":{"min":{"lng":80.7771,"lat":6.5422},"max":{"lng":81.2716,"lat":7.625}},"geojson_properties":{"GID_1":"LKA.3_1","GID_0":"LKA","COUNTRY":"Sri Lanka","NAME_1":"Badulla","VARNAME_1":"NA","NL_NAME_1":"NA","TYPE_1":"Distrikkaya","ENGTYPE_1":"District","CC_1":"NA","HASC_1":"LK.BD","ISO_1":"NA"}},{"id":"LKA.4_1","name":"Batticaloa","bounds":{"min":{"lng":81.2249,"lat":7.3988},"max":{"lng":81.8166,"lat":8.2681}},"geojson_properties":{"GID_1":"LKA.4_1","GID_0":"LKA","COUNTRY":"Sri Lanka","NAME_1":"Batticaloa","VARNAME_1":"NA","NL_NAME_1":"NA","TYPE_1":"Distrikkaya","ENGTYPE_1":"District","CC_1":"NA","HASC_1":"LK.BC","ISO_1":"NA"}},{"id":"LKA.5_1","name":"Colombo","bounds":{"min":{"lng":79.8399,"lat":6.7141},"max":{"lng":80.2234,"lat":6.9794}},"geojson_properties":{"GID_1":"LKA.5_1","GID_0":"LKA","COUNTRY":"Sri Lanka","NAME_1":"Colombo","VARNAME_1":"NA","NL_NAME_1":"NA","TYPE_1":"Distrikkaya","ENGTYPE_1":"District","CC_1":"NA","HASC_1":"LK.CO","ISO_1":"NA"}},{"id":"LKA.6_1","name":"Galle","bounds":{"min":{"lng":79.989,"lat":5.9651},"max":{"lng":80.4957,"lat":6.4396}},"geojson_properties":{"GID_1":"LKA.6_1","GID_0":"LKA","COUNTRY":"Sri Lanka","NAME_1":"Galle","VARNAME_1":"NA","NL_NAME_1":"NA","TYPE_1":"Distrikkaya","ENGTYPE_1":"District","CC_1":"NA","HASC_1":"LK.GL","ISO_1":"NA"}},{"id":"LKA.7_1","name":"Gampaha","bounds":{"min":{"lng":79.8171,"lat":6.9073},"max":{"lng":80.2084,"lat":7.3306}},"geojson_properties":{"GID_1":"LKA.7_1","GID_0":"LKA","COUNTRY":"Sri Lanka","NAME_1":"Gampaha","VARNAME_1":"NA","NL_NAME_1":"NA","TYPE_1":"Distrikkaya","ENGTYPE_1":"District","CC_1":"NA","HASC_1":"LK.GQ","ISO_1":"NA"}},{"id":"LKA.8_1","name":"Hambantota","bounds":{"min":{"lng":80.6083,"lat":5.9718},"max":{"lng":81.706,"lat":6.5788}},"geojson_properties":{"GID_1":"LKA.8_1","GID_0":"LKA","COUNTRY":"Sri Lanka","NAME_1":"Hambantota","VARNAME_1":"NA","NL_NAME_1":"NA","TYPE_1":"Distrikkaya","ENGTYPE_1":"District","CC_1":"NA","HASC_1":"LK.HB","ISO_1":"NA"}},{"id":"LKA.9_1","name":"Jaffna","bounds":{"min":{"lng":79.5221,"lat":9.384},"max":{"lng":80.6196,"lat":9.836}},"geojson_properties":{"GID_1":"LKA.9_1","GID_0":"LKA","COUNTRY":"Sri Lanka","NAME_1":"Jaffna","VARNAME_1":"NA","NL_NAME_1":"NA","TYPE_1":"Distrikkaya","ENGTYPE_1":"District","CC_1":"NA","HASC_1":"LK.JA","ISO_1":"NA"}},{"id":"LKA.10_1","name":"Kalutara","bounds":{"min":{"lng":79.8865,"lat":6.3249},"max":{"lng":80.3819,"lat":6.8249}},"geojson_properties":{"GID_1":"LKA.10_1","GID_0":"LKA","COUNTRY":"Sri Lanka","NAME_1":"Kalutara","VARNAME_1":"NA","NL_NAME_1":"NA","TYPE_1":"Distrikkaya","ENGTYPE_1":"District","CC_1":"NA","HASC_1":"LK.KT","ISO_1":"NA"}},{"id":"LKA.11_1","name":"Kandy","bounds":{"min":{"lng":80.422,"lat":6.9388},"max":{"lng":81.0165,"lat":7.4899}},"geojson_properties":{"GID_1":"LKA.11_1","GID_0":"LKA","COUNTRY":"Sri Lanka","NAME_1":"Kandy","VARNAME_1":"MahaNuwara","NL_NAME_1":"NA","TYPE_1":"Distrikkaya","ENGTYPE_1":"District","CC_1":"NA","HASC_1":"LK.KY","ISO_1":"NA"}},{"id":"LKA.12_1","name":"Kegalle","bounds":{"min":{"lng":80.1453,"lat":6.83},"max":{"lng":80.5481,"lat":7.3967}},"geojson_properties":{"GID_1":"LKA.12_1","GID_0":"LKA","COUNTRY":"Sri Lanka","NAME_1":"Kegalle","VARNAME_1":"Kegalla","NL_NAME_1":"NA","TYPE_1":"Distrikkaya","ENGTYPE_1":"District","CC_1":"NA","HASC_1":"LK.KE","ISO_1":"NA"}},{"id":"LKA.13_1","name":"Kilinochchi","bounds":{"min":{"lng":79.8843,"lat":9.2086},"max":{"lng":80.6155,"lat":9.6913}},"geojson_properties":{"GID_1":"LKA.13_1","GID_0":"LKA","COUNTRY":"Sri Lanka","NAME_1":"Kilinochchi","VARNAME_1":"NA","NL_NAME_1":"NA","TYPE_1":"Distrikkaya","ENGTYPE_1":"District","CC_1":"NA","HASC_1":"LK.KL","ISO_1":"NA"}},{"id":"LKA.14_1","name":"Kurunegala","bounds":{"min":{"lng":79.9004,"lat":7.2562},"max":{"lng":80.5759,"lat":8.1964}},"geojson_properties":{"GID_1":"LKA.14_1","GID_0":"LKA","COUNTRY":"Sri Lanka","NAME_1":"Kurunegala","VARNAME_1":"NA","NL_NAME_1":"NA","TYPE_1":"Distrikkaya","ENGTYPE_1":"District","CC_1":"NA","HASC_1":"LK.KG","ISO_1":"NA"}},{"id":"LKA.15_1","name":"Mannar","bounds":{"min":{"lng":79.6396,"lat":8.5219},"max":{"lng":80.4025,"lat":9.2373}},"geojson_properties":{"GID_1":"LKA.15_1","GID_0":"LKA","COUNTRY":"Sri Lanka","NAME_1":"Mannar","VARNAME_1":"NA","NL_NAME_1":"NA","TYPE_1":"Distrikkaya","ENGTYPE_1":"District","CC_1":"NA","HASC_1":"LK.MB","ISO_1":"NA"}},{"id":"LKA.16_1","name":"Matale","bounds":{"min":{"lng":80.4944,"lat":7.3841},"max":{"lng":80.9947,"lat":8.0124}},"geojson_properties":{"GID_1":"LKA.16_1","GID_0":"LKA","COUNTRY":"Sri Lanka","NAME_1":"Matale","VARNAME_1":"NA","NL_NAME_1":"NA","TYPE_1":"Distrikkaya","ENGTYPE_1":"District","CC_1":"NA","HASC_1":"LK.MT","ISO_1":"NA"}},{"id":"LKA.17_1","name":"Matara","bounds":{"min":{"lng":80.3775,"lat":5.9185},"max":{"lng":80.7241,"lat":6.3975}},"geojson_properties":{"GID_1":"LKA.17_1","GID_0":"LKA","COUNTRY":"Sri Lanka","NAME_1":"Matara","VARNAME_1":"NA","NL_NAME_1":"NA","TYPE_1":"Distrikkaya","ENGTYPE_1":"District","CC_1":"NA","HASC_1":"LK.MH","ISO_1":"NA"}},{"id":"LKA.18_1","name":"Moneragala","bounds":{"min":{"lng":80.8278,"lat":6.2958},"max":{"lng":81.6372,"lat":7.458}},"geojson_properties":{"GID_1":"LKA.18_1","GID_0":"LKA","COUNTRY":"Sri Lanka","NAME_1":"Moneragala","VARNAME_1":"Monaragala","NL_NAME_1":"NA","TYPE_1":"Distrikkaya","ENGTYPE_1":"District","CC_1":"NA","HASC_1":"LK.MJ","ISO_1":"NA"}},{"id":"LKA.19_1","name":"Mullaitivu","bounds":{"min":{"lng":80.175,"lat":8.9369},"max":{"lng":80.964,"lat":9.4579}},"geojson_properties":{"GID_1":"LKA.19_1","GID_0":"LKA","COUNTRY":"Sri Lanka","NAME_1":"Mullaitivu","VARNAME_1":"Mulativu","NL_NAME_1":"NA","TYPE_1":"Distrikkaya","ENGTYPE_1":"District","CC_1":"NA","HASC_1":"LK.MP","ISO_1":"NA"}},{"id":"LKA.20_1","name":"Nuwara Eliya","bounds":{"min":{"lng":80.4324,"lat":6.7514},"max":{"lng":80.9663,"lat":7.2739}},"geojson_properties":{"GID_1":"LKA.20_1","GID_0":"LKA","COUNTRY":"Sri Lanka","NAME_1":"Nuwara Eliya","VARNAME_1":"NuvaraEliya","NL_NAME_1":"NA","TYPE_1":"Distrikkaya","ENGTYPE_1":"District","CC_1":"NA","HASC_1":"LK.NW","ISO_1":"NA"}},{"id":"LKA.21_1","name":"Polonnaruwa","bounds":{"min":{"lng":80.7494,"lat":7.647},"max":{"lng":81.34,"lat":8.3452}},"geojson_properties":{"GID_1":"LKA.21_1","GID_0":"LKA","COUNTRY":"Sri Lanka","NAME_1":"Polonnaruwa","VARNAME_1":"NA","NL_NAME_1":"NA","TYPE_1":"Distrikkaya","ENGTYPE_1":"District","CC_1":"NA","HASC_1":"LK.PR","ISO_1":"NA"}},{"id":"LKA.22_1","name":"Puttalam","bounds":{"min":{"lng":79.6929,"lat":7.2669},"max":{"lng":80.1533,"lat":8.5655}},"geojson_properties":{"GID_1":"LKA.22_1","GID_0":"LKA","COUNTRY":"Sri Lanka","NAME_1":"Puttalam","VARNAME_1":"NA","NL_NAME_1":"NA","TYPE_1":"Distrikkaya","ENGTYPE_1":"District","CC_1":"NA","HASC_1":"LK.PX","ISO_1":"NA"}},{"id":"LKA.23_1","name":"Ratnapura","bounds":{"min":{"lng":80.177,"lat":6.2279},"max":{"lng":80.9527,"lat":6.9311}},"geojson_properties":{"GID_1":"LKA.23_1","GID_0":"LKA","COUNTRY":"Sri Lanka","NAME_1":"Ratnapura","VARNAME_1":"NA","NL_NAME_1":"NA","TYPE_1":"Distrikkaya","ENGTYPE_1":"District","CC_1":"NA","HASC_1":"LK.RN","ISO_1":"NA"}},{"id":"LKA.24_1","name":"Trincomalee","bounds":{"min":{"lng":80.753,"lat":8.1488},"max":{"lng":81.404,"lat":8.9909}},"geojson_properties":{"GID_1":"LKA.24_1","GID_0":"LKA","COUNTRY":"Sri Lanka","NAME_1":"Trincomalee","VARNAME_1":"NA","NL_NAME_1":"NA","TYPE_1":"Distrikkaya","ENGTYPE_1":"District","CC_1":"NA","HASC_1":"LK.TC","ISO_1":"NA"}},{"id":"LKA.25_1","name":"Vavuniya","bounds":{"min":{"lng":80.17,"lat":8.546},"max":{"lng":80.787,"lat":9.1263}},"geojson_properties":{"GID_1":"LKA.25_1","GID_0":"LKA","COUNTRY":"Sri Lanka","NAME_1":"Vavuniya","VARNAME_1":"NA","NL_NAME_1":"NA","TYPE_1":"Distrikkaya","ENGTYPE_1":"District","CC_1":"NA","HASC_1":"LK.VA","ISO_1":"NA"}}]
