[{"id":"PAN.1_1","name":"Bocas del Toro","bounds":{"min":{"lng":-82.9342,"lat":8.8279},"max":{"lng":-81.9157,"lat":9.6165}},"geojson_properties":{"GID_1":"PAN.1_1","GID_0":"PAN","COUNTRY":"Panama","NAME_1":"Bocas del Toro","VARNAME_1":"NA","NL_NAME_1":"NA","TYPE_1":"Provincia","ENGTYPE_1":"Province","CC_1":"NA","HASC_1":"PA.BC","ISO_1":"PA-1"}},{"id":"PAN.2_1","name":"Chiriquí","bounds":{"min":{"lng":-83.0519,"lat":7.8593},"max":{"lng":-81.5074,"lat":8.9195}},"geojson_properties":{"GID_1":"PAN.2_1","GID_0":"PAN","COUNTRY":"Panama","NAME_1":"Chiriquí","VARNAME_1":"NA","NL_NAME_1":"NA","TYPE_1":"Provincia","ENGTYPE_1":"Province","CC_1":"NA","HASC_1":"PA.CH","ISO_1":"NA"}},{"id":"PAN.3_1","name":"Coclé","bounds":{"min":{"lng":-80.8229,"lat":8.0871},"max":{"lng":-80.0527,"lat":9.064}},"geojson_properties":{"GID_1":"PAN.3_1","GID_0":"PAN","COUNTRY":"Panama","NAME_1":"Coclé","VARNAME_1":"NA","NL_NAME_1":"NA","TYPE_1":"Provincia","ENGTYPE_1":"Province","CC_1":"NA","HASC_1":"PA.CC","ISO_1":"NA"}},{"id":"PAN.4_1","name":"Colón","bounds":{"min":{"lng":-80.8766,"lat":8.6327},"max":{"lng":-79.0803,"lat":9.6468}},"geojson_properties":{"GID_1":"PAN.4_1","GID_0":"PAN","COUNTRY":"Panama","NAME_1":"Colón","VARNAME_1":"NA","NL_NAME_1":"NA","TYPE_1":"Provincia","ENGTYPE_1":"Province","CC_1":"NA","HASC_1":"PA.CL","ISO_1":"NA"}},{"id":"PAN.5_1","name":"Darién","bounds":{"min":{"lng":-78.5125,"lat":7.2184},"max":{"lng":-77.1293,"lat":9.0927}},"geojson_properties":{"GID_1":"PAN.5_1","GID_0":"PAN","COUNTRY":"Panama","NAME_1":"Darién","VARNAME_1":"NA","NL_NAME_1":"NA","TYPE_1":"Provincia","ENGTYPE_1":"Province","CC_1":"NA","HASC_1":"PA.DR","ISO_1":"NA"}},{"id":"PAN.6_1","name":"Emberá","bounds":{"min":{"lng":-78.3374,"lat":7.5815},"max":{"lng":-77.2392,"lat":8.7776}},"geojson_properties":{"GID_1":"PAN.6_1","GID_0":"PAN","COUNTRY":"Panama","NAME_1":"Emberá","VARNAME_1":"Emberá-Wounaan","NL_NAME_1":"NA","TYPE_1":"ComarcaIndígena","ENGTYPE_1":"IndigenousTerritory","CC_1":"NA","HASC_1":"PA.EM","ISO_1":"NA"}},{"id":"PAN.7_1","name":"Herrera","bounds":{"min":{"lng":-80.9633,"lat":7.5101},"max":{"lng":-80.3662,"lat":8.1317}},"geojson_properties":{"GID_1":"PAN.7_1","GID_0":"PAN","COUNTRY":"Panama","NAME_1":"Herrera","VARNAME_1":"NA","NL_NAME_1":"NA","TYPE_1":"Provincia","ENGTYPE_1":"Province","CC_1":"NA","HASC_1":"PA.HE","ISO_1":"PA-6"}},{"id":"PAN.8_1","name":"Kuna Yala","bounds":{"min":{"lng":-79.2824,"lat":8.5012},"max":{"lng":-77.3574,"lat":9.6004}},"geojson_properties":{"GID_1":"PAN.8_1","GID_0":"PAN","COUNTRY":"Panama","NAME_1":"Kuna Yala","VARNAME_1":"NA","NL_NAME_1":"NA","TYPE_1":"ComarcaIndígena","ENGTYPE_1":"IndigenousTerritory","CC_1":"NA","HASC_1":"PA.SB","ISO_1":"NA"}},{"id":"PAN.9_1","name":"Los Santos","bounds":{"min":{"lng":-80.7383,"lat":7.2274},"max":{"lng":-79.9912,"lat":8.004}},"geojson_properties":{"GID_1":"PAN.9_1","GID_0":"PAN","COUNTRY":"Panama","NAME_1":"Los Santos","VARNAME_1":"NA","NL_NAME_1":"NA","TYPE_1":"Provincia","ENGTYPE_1":"Province","CC_1":"NA","HASC_1":"PA.LS","ISO_1":"PA-7"}},{"id":"PAN.10_1","name":"Ngöbe Buglé","bounds":{"min":{"lng":-82.4455,"lat":8.1459},"max":{"lng":-81.1327,"lat":9.1865}},"geojson_properties":{"GID_1":"PAN.10_1","GID_0":"PAN","COUNTRY":"Panama","NAME_1":"Ngöbe Buglé","VARNAME_1":"NA","NL_NAME_1":"NA","TYPE_1":"ComarcaIndígena","ENGTYPE_1":"IndigenousTerritory","CC_1":"NA","HASC_1":"PA.NB","ISO_1":"NA"}},{"id":"PAN.12_1","name":"Panamá","bounds":{"min":{"lng":-79.6949,"lat":7.9999},"max":{"lng":-78.05,"lat":9.5233}},"geojson_properties":{"GID_1":"PAN.12_1","GID_0":"PAN","COUNTRY":"Panama","NAME_1":"Panamá","VARNAME_1":"Panam ","NL_NAME_1":"NA","TYPE_1":"Provincia","ENGTYPE_1":"Province","CC_1":"NA","HASC_1":"PA.PN","ISO_1":"NA"}},{"id":"PAN.11_1","name":"Panamá Oeste","bounds":{"min":{"lng":-80.1704,"lat":8.4013},"max":{"lng":-79.509,"lat":9.1903}},"geojson_properties":{"GID_1":"PAN.11_1","GID_0":"PAN","COUNTRY":"Panama","NAME_1":"Panamá Oeste","VARNAME_1":"NA","NL_NAME_1":"NA","TYPE_1":"Provincia","ENGTYPE_1":"Province","CC_1":"NA","HASC_1":"PA.PO","ISO_1":"NA"}},{"id":"PAN.13_1","name":"Veraguas","bounds":{"min":{"lng":-82.264,"lat":7.2024},"max":{"lng":-80.6147,"lat":9.0001}},"geojson_properties":{"GID_1":"PAN.13_1","GID_0":"PAN","COUNTRY":"Panama","NAME_1":"Veraguas","VARNAME_1":"NA","NL_NAME_1":"NA","TYPE_1":"Provincia","ENGTYPE_1":"Province","CC_1":"NA","HASC_1":"PA.VR","ISO_1":"PA-9"}}]
