[{"id":"GRL.1_1","name":"Kujalleq","bounds":{"min":{"lng":-48.2578,"lat":59.7447},"max":{"lng":-42.0615,"lat":62.7958}},"geojson_properties":{"GID_1":"GRL.1_1","GID_0":"GRL","COUNTRY":"Greenland","NAME_1":"Kujalleq","VARNAME_1":"KommuneKujalleq|Kitaa|WestGree","NL_NAME_1":"NA","TYPE_1":"Kommuner","ENGTYPE_1":"Commune","CC_1":"NA","HASC_1":"GL.KU","ISO_1":"NA"}},{"id":"GRL.2_1","name":"Northeast Greenland National Par","bounds":{"min":{"lng":-61.9792,"lat":70.828},"max":{"lng":-0.013,"lat":83.6583}},"geojson_properties":{"GID_1":"GRL.2_1","GID_0":"GRL","COUNTRY":"Greenland","NAME_1":"Northeast Greenland National Par","VARNAME_1":"NA","NL_NAME_1":"NA","TYPE_1":"NationalPark","ENGTYPE_1":"NationalPark","CC_1":"NA","HASC_1":"GL.UO","ISO_1":"NA"}},{"id":"GRL.3_1","name":"Qaasuitsup","bounds":{"min":{"lng":-73.2432,"lat":67.2083},"max":{"lng":-44.0968,"lat":81.2042}},"geojson_properties":{"GID_1":"GRL.3_1","GID_0":"GRL","COUNTRY":"Greenland","NAME_1":"Qaasuitsup","VARNAME_1":"QaasuitsupKommunia|Avannaa|Kita","NL_NAME_1":"NA","TYPE_1":"Kommuner","ENGTYPE_1":"Commune","CC_1":"NA","HASC_1":"GL.QS","ISO_1":"NA"}},{"id":"GRL.4_1","name":"Qeqqata","bounds":{"min":{"lng":-53.9661,"lat":64.0047},"max":{"lng":-43.867,"lat":67.633}},"geojson_properties":{"GID_1":"GRL.4_1","GID_0":"GRL","COUNTRY":"Greenland","NAME_1":"Qeqqata","VARNAME_1":"QeqqataKommunia|Kitaa|WestGree","NL_NAME_1":"NA","TYPE_1":"Kommuner","ENGTYPE_1":"Commune","CC_1":"NA","HASC_1":"GL.QT","ISO_1":"NA"}},{"id":"GRL.5_1","name":"Sermersooq","bounds":{"min":{"lng":-51.9036,"lat":60.7958},"max":{"lng":-21.388,"lat":72.0208}},"geojson_properties":{"GID_1":"GRL.5_1","GID_0":"GRL","COUNTRY":"Greenland","NAME_1":"Sermersooq","VARNAME_1":"KommuneqarfikSermersooq|Tunu|Ea","NL_NAME_1":"NA","TYPE_1":"Kommuner","ENGTYPE_1":"Commune","CC_1":"NA","HASC_1":"GL.SE","ISO_1":"NA"}}]
