[{"id":"LSO.1_1","name":"Berea","bounds":{"min":{"lng":27.5117,"lat":-29.3967},"max":{"lng":28.2944,"lat":-28.9465}},"geojson_properties":{"GID_1":"LSO.1_1","GID_0":"LSO","COUNTRY":"Lesotho","NAME_1":"Berea","VARNAME_1":"Teyateyaneng","NL_NAME_1":"NA","TYPE_1":"District","ENGTYPE_1":"District","CC_1":"NA","HASC_1":"LS.BE","ISO_1":"LS-D"}},{"id":"LSO.2_1","name":"Butha-Buthe","bounds":{"min":{"lng":28.224,"lat":-29.0863},"max":{"lng":28.8188,"lat":-28.5708}},"geojson_properties":{"GID_1":"LSO.2_1","GID_0":"LSO","COUNTRY":"Lesotho","NAME_1":"Butha-Buthe","VARNAME_1":"ButhaButhe","NL_NAME_1":"NA","TYPE_1":"District","ENGTYPE_1":"District","CC_1":"NA","HASC_1":"LS.BB","ISO_1":"NA"}},{"id":"LSO.3_1","name":"Leribe","bounds":{"min":{"lng":27.6414,"lat":-29.3703},"max":{"lng":28.7936,"lat":-28.6937}},"geojson_properties":{"GID_1":"LSO.3_1","GID_0":"LSO","COUNTRY":"Lesotho","NAME_1":"Leribe","VARNAME_1":"NA","NL_NAME_1":"NA","TYPE_1":"District","ENGTYPE_1":"District","CC_1":"NA","HASC_1":"LS.LE","ISO_1":"LS-C"}},{"id":"LSO.4_1","name":"Mafeteng","bounds":{"min":{"lng":27.0116,"lat":-30.0569},"max":{"lng":28.3147,"lat":-29.5263}},"geojson_properties":{"GID_1":"LSO.4_1","GID_0":"LSO","COUNTRY":"Lesotho","NAME_1":"Mafeteng","VARNAME_1":"NA","NL_NAME_1":"NA","TYPE_1":"District","ENGTYPE_1":"District","CC_1":"NA","HASC_1":"LS.MF","ISO_1":"LS-E"}},{"id":"LSO.5_1","name":"Maseru","bounds":{"min":{"lng":27.3002,"lat":-29.9257},"max":{"lng":28.2109,"lat":-29.2822}},"geojson_properties":{"GID_1":"LSO.5_1","GID_0":"LSO","COUNTRY":"Lesotho","NAME_1":"Maseru","VARNAME_1":"NA","NL_NAME_1":"NA","TYPE_1":"District","ENGTYPE_1":"District","CC_1":"NA","HASC_1":"LS.MS","ISO_1":"LS-A"}},{"id":"LSO.6_1","name":"Mohale's Hoek","bounds":{"min":{"lng":27.1765,"lat":-30.4177},"max":{"lng":28.5951,"lat":-29.7873}},"geojson_properties":{"GID_1":"LSO.6_1","GID_0":"LSO","COUNTRY":"Lesotho","NAME_1":"Mohale's Hoek","VARNAME_1":"MohalesHoek","NL_NAME_1":"NA","TYPE_1":"District","ENGTYPE_1":"District","CC_1":"NA","HASC_1":"LS.MH","ISO_1":"LS-F"}},{"id":"LSO.7_1","name":"Mokhotlong","bounds":{"min":{"lng":28.5573,"lat":-29.5811},"max":{"lng":29.4557,"lat":-28.756}},"geojson_properties":{"GID_1":"LSO.7_1","GID_0":"LSO","COUNTRY":"Lesotho","NAME_1":"Mokhotlong","VARNAME_1":"NA","NL_NAME_1":"NA","TYPE_1":"District","ENGTYPE_1":"District","CC_1":"NA","HASC_1":"LS.MK","ISO_1":"LS-J"}},{"id":"LSO.8_1","name":"Qacha's Nek","bounds":{"min":{"lng":28.2253,"lat":-30.1697},"max":{"lng":29.1694,"lat":-29.7094}},"geojson_properties":{"GID_1":"LSO.8_1","GID_0":"LSO","COUNTRY":"Lesotho","NAME_1":"Qacha's Nek","VARNAME_1":"Quacha'sNek|QuachasNek","NL_NAME_1":"NA","TYPE_1":"District","ENGTYPE_1":"District","CC_1":"NA","HASC_1":"LS.QN","ISO_1":"LS-H"}},{"id":"LSO.9_1","name":"Quthing","bounds":{"min":{"lng":27.5619,"lat":-30.6756},"max":{"lng":28.373,"lat":-30.0224}},"geojson_properties":{"GID_1":"LSO.9_1","GID_0":"LSO","COUNTRY":"Lesotho","NAME_1":"Quthing","VARNAME_1":"NA","NL_NAME_1":"NA","TYPE_1":"District","ENGTYPE_1":"District","CC_1":"NA","HASC_1":"LS.QT","ISO_1":"LS-G"}},{"id":"LSO.10_1","name":"Thaba-Tseka","bounds":{"min":{"lng":28.0932,"lat":-29.8976},"max":{"lng":29.3243,"lat":-29.1198}},"geojson_properties":{"GID_1":"LSO.10_1","GID_0":"LSO","COUNTRY":"Lesotho","NAME_1":"Thaba-Tseka","VARNAME_1":"ThabaTseka","NL_NAME_1":"NA","TYPE_1":"District","ENGTYPE_1":"District","CC_1":"NA","HASC_1":"LS.TT","ISO_1":"LS-K"}}]
