[{"id":"AZE.1_1","name":"Absheron","bounds":{"min":{"lng":48.7634,"lat":39.665},"max":{"lng":50.6078,"lat":40.9809}},"geojson_properties":{"GID_1":"AZE.1_1","GID_0":"AZE","COUNTRY":"Azerbaijan","NAME_1":"Absheron","VARNAME_1":"NA","NL_NAME_1":"NA","TYPE_1":"İqtisadiRayonu","ENGTYPE_1":"Region","CC_1":"NA","HASC_1":"NA","ISO_1":"NA"}},{"id":"AZE.2_1","name":"Aran","bounds":{"min":{"lng":46.7298,"lat":39.1282},"max":{"lng":49.4393,"lat":40.9687}},"geojson_properties":{"GID_1":"AZE.2_1","GID_0":"AZE","COUNTRY":"Azerbaijan","NAME_1":"Aran","VARNAME_1":"NA","NL_NAME_1":"NA","TYPE_1":"İqtisadiRayonu","ENGTYPE_1":"Region","CC_1":"NA","HASC_1":"NA","ISO_1":"NA"}},{"id":"AZE.3_1","name":"Daglig-Shirvan","bounds":{"min":{"lng":47.7325,"lat":40.2648},"max":{"lng":49.2631,"lat":41.0631}},"geojson_properties":{"GID_1":"AZE.3_1","GID_0":"AZE","COUNTRY":"Azerbaijan","NAME_1":"Daglig-Shirvan","VARNAME_1":"NA","NL_NAME_1":"NA","TYPE_1":"İqtisadiRayonu","ENGTYPE_1":"Region","CC_1":"NA","HASC_1":"NA","ISO_1":"NA"}},{"id":"AZE.4_1","name":"Ganja-Qazakh","bounds":{"min":{"lng":45.0026,"lat":40.2564},"max":{"lng":46.9636,"lat":41.4681}},"geojson_properties":{"GID_1":"AZE.4_1","GID_0":"AZE","COUNTRY":"Azerbaijan","NAME_1":"Ganja-Qazakh","VARNAME_1":"NA","NL_NAME_1":"NA","TYPE_1":"İqtisadiRayonu","ENGTYPE_1":"Region","CC_1":"NA","HASC_1":"NA","ISO_1":"NA"}},{"id":"AZE.5_1","name":"Kalbajar-Lachin","bounds":{"min":{"lng":45.5786,"lat":38.8727},"max":{"lng":46.8722,"lat":40.3145}},"geojson_properties":{"GID_1":"AZE.5_1","GID_0":"AZE","COUNTRY":"Azerbaijan","NAME_1":"Kalbajar-Lachin","VARNAME_1":"NA","NL_NAME_1":"NA","TYPE_1":"İqtisadiRayonu","ENGTYPE_1":"Region","CC_1":"NA","HASC_1":"NA","ISO_1":"NA"}},{"id":"AZE.6_1","name":"Lankaran","bounds":{"min":{"lng":48.0091,"lat":38.3972},"max":{"lng":49.2378,"lat":39.4215}},"geojson_properties":{"GID_1":"AZE.6_1","GID_0":"AZE","COUNTRY":"Azerbaijan","NAME_1":"Lankaran","VARNAME_1":"NA","NL_NAME_1":"NA","TYPE_1":"İqtisadiRayonu","ENGTYPE_1":"Region","CC_1":"NA","HASC_1":"NA","ISO_1":"AZ-LA"}},{"id":"AZE.7_1","name":"Nakhchivan","bounds":{"min":{"lng":44.7726,"lat":38.8202},"max":{"lng":46.1509,"lat":39.7855}},"geojson_properties":{"GID_1":"AZE.7_1","GID_0":"AZE","COUNTRY":"Azerbaijan","NAME_1":"Nakhchivan","VARNAME_1":"NA","NL_NAME_1":"NA","TYPE_1":"İqtisadiRayonu","ENGTYPE_1":"Region","CC_1":"NA","HASC_1":"NA","ISO_1":"NA"}},{"id":"AZE.8_1","name":"Quba-Khachmaz","bounds":{"min":{"lng":47.802,"lat":40.8551},"max":{"lng":49.3671,"lat":41.885}},"geojson_properties":{"GID_1":"AZE.8_1","GID_0":"AZE","COUNTRY":"Azerbaijan","NAME_1":"Quba-Khachmaz","VARNAME_1":"NA","NL_NAME_1":"NA","TYPE_1":"İqtisadiRayonu","ENGTYPE_1":"Region","CC_1":"NA","HASC_1":"NA","ISO_1":"NA"}},{"id":"AZE.9_1","name":"Shaki-Zaqatala","bounds":{"min":{"lng":46.2478,"lat":40.6395},"max":{"lng":48.0311,"lat":41.9075}},"geojson_properties":{"GID_1":"AZE.9_1","GID_0":"AZE","COUNTRY":"Azerbaijan","NAME_1":"Shaki-Zaqatala","VARNAME_1":"NA","NL_NAME_1":"NA","TYPE_1":"İqtisadiRayonu","ENGTYPE_1":"Region","CC_1":"NA","HASC_1":"NA","ISO_1":"NA"}},{"id":"AZE.10_1","name":"Yukhari-Karabakh","bounds":{"min":{"lng":46.4341,"lat":39.1325},"max":{"lng":47.6405,"lat":40.48}},"geojson_properties":{"GID_1":"AZE.10_1","GID_0":"AZE","COUNTRY":"Azerbaijan","NAME_1":"Yukhari-Karabakh","VARNAME_1":"NA","NL_NAME_1":"NA","TYPE_1":"İqtisadiRayonu","ENGTYPE_1":"Region","CC_1":"NA","HASC_1":"NA","ISO_1":"NA"}}]
