[{"id":"NLD.1_1","name":"Drenthe","bounds":{"min":{"lng":6.1263,"lat":52.6132},"max":{"lng":7.0927,"lat":53.2039}},"geojson_properties":{"GID_1":"NLD.1_1","GID_0":"NLD","COUNTRY":"Netherlands","NAME_1":"Drenthe","VARNAME_1":"NA","NL_NAME_1":"NA","TYPE_1":"Provincie","ENGTYPE_1":"Province","CC_1":"NA","HASC_1":"NL.DR","ISO_1":"NL-DR"}},{"id":"NLD.2_1","name":"Flevoland","bounds":{"min":{"lng":5.1267,"lat":52.2533},"max":{"lng":5.9913,"lat":52.8436}},"geojson_properties":{"GID_1":"NLD.2_1","GID_0":"NLD","COUNTRY":"Netherlands","NAME_1":"Flevoland","VARNAME_1":"NA","NL_NAME_1":"NA","TYPE_1":"Provincie","ENGTYPE_1":"Province","CC_1":"NA","HASC_1":"NL.FL","ISO_1":"NL-FL"}},{"id":"NLD.3_1","name":"Fryslân","bounds":{"min":{"lng":4.8497,"lat":52.801},"max":{"lng":6.436,"lat":53.5096}},"geojson_properties":{"GID_1":"NLD.3_1","GID_0":"NLD","COUNTRY":"Netherlands","NAME_1":"Fryslân","VARNAME_1":"Friesland","NL_NAME_1":"NA","TYPE_1":"Provincie","ENGTYPE_1":"Province","CC_1":"NA","HASC_1":"NL.FR","ISO_1":"NL-FR"}},{"id":"NLD.4_1","name":"Gelderland","bounds":{"min":{"lng":4.9979,"lat":51.7343},"max":{"lng":6.8328,"lat":52.5219}},"geojson_properties":{"GID_1":"NLD.4_1","GID_0":"NLD","COUNTRY":"Netherlands","NAME_1":"Gelderland","VARNAME_1":"Geldern|Gheldria|Guelders|Gueldr","NL_NAME_1":"NA","TYPE_1":"Provincie","ENGTYPE_1":"Province","CC_1":"NA","HASC_1":"NL.GE","ISO_1":"NL-GE"}},{"id":"NLD.5_1","name":"Groningen","bounds":{"min":{"lng":6.1739,"lat":52.839},"max":{"lng":7.227,"lat":53.5546}},"geojson_properties":{"GID_1":"NLD.5_1","GID_0":"NLD","COUNTRY":"Netherlands","NAME_1":"Groningen","VARNAME_1":"Groninga|Groningue","NL_NAME_1":"NA","TYPE_1":"Provincie","ENGTYPE_1":"Province","CC_1":"NA","HASC_1":"NL.GR","ISO_1":"NL-GR"}},{"id":"NLD.6_1","name":"IJsselmeer","bounds":{"min":{"lng":4.9616,"lat":52.2452},"max":{"lng":6.0296,"lat":53.0907}},"geojson_properties":{"GID_1":"NLD.6_1","GID_0":"NLD","COUNTRY":"Netherlands","NAME_1":"IJsselmeer","VARNAME_1":"NA","NL_NAME_1":"NA","TYPE_1":"Waterbody","ENGTYPE_1":"Waterbody","CC_1":"NA","HASC_1":"NA","ISO_1":"NA"}},{"id":"NLD.7_1","name":"Limburg","bounds":{"min":{"lng":5.5706,"lat":50.7235},"max":{"lng":6.2264,"lat":51.7795}},"geojson_properties":{"GID_1":"NLD.7_1","GID_0":"NLD","COUNTRY":"Netherlands","NAME_1":"Limburg","VARNAME_1":"Limbourg|Limburgo","NL_NAME_1":"NA","TYPE_1":"Provincie","ENGTYPE_1":"Province","CC_1":"NA","HASC_1":"NL.LI","ISO_1":"NL-LI"}},{"id":"NLD.8_1","name":"Noord-Brabant","bounds":{"min":{"lng":4.1917,"lat":51.2215},"max":{"lng":6.0564,"lat":51.8314}},"geojson_properties":{"GID_1":"NLD.8_1","GID_0":"NLD","COUNTRY":"Netherlands","NAME_1":"Noord-Brabant","VARNAME_1":"BrabantedelNorte|BrabantedoN","NL_NAME_1":"NA","TYPE_1":"Provincie","ENGTYPE_1":"Province","CC_1":"NA","HASC_1":"NL.NB","ISO_1":"NL-NB"}},{"id":"NLD.9_1","name":"Noord-Holland","bounds":{"min":{"lng":4.4942,"lat":52.1656},"max":{"lng":5.3216,"lat":53.1832}},"geojson_properties":{"GID_1":"NLD.9_1","GID_0":"NLD","COUNTRY":"Netherlands","NAME_1":"Noord-Holland","VARNAME_1":"HolandadoNorte|Hollande-septen","NL_NAME_1":"NA","TYPE_1":"Provincie","ENGTYPE_1":"Province","CC_1":"NA","HASC_1":"NL.NH","ISO_1":"NL-NH"}},{"id":"NLD.10_1","name":"Overijssel","bounds":{"min":{"lng":5.7844,"lat":52.1182},"max":{"lng":7.0722,"lat":52.8537}},"geojson_properties":{"GID_1":"NLD.10_1","GID_0":"NLD","COUNTRY":"Netherlands","NAME_1":"Overijssel","VARNAME_1":"NA","NL_NAME_1":"NA","TYPE_1":"Provincie","ENGTYPE_1":"Province","CC_1":"NA","HASC_1":"NL.OV","ISO_1":"NL-OV"}},{"id":"NLD.11_1","name":"Utrecht","bounds":{"min":{"lng":4.7944,"lat":51.8586},"max":{"lng":5.6337,"lat":52.3037}},"geojson_properties":{"GID_1":"NLD.11_1","GID_0":"NLD","COUNTRY":"Netherlands","NAME_1":"Utrecht","VARNAME_1":"NA","NL_NAME_1":"NA","TYPE_1":"Provincie","ENGTYPE_1":"Province","CC_1":"NA","HASC_1":"NL.UT","ISO_1":"NL-UT"}},{"id":"NLD.12_1","name":"Zeeland","bounds":{"min":{"lng":3.3608,"lat":51.1989},"max":{"lng":4.2781,"lat":51.7579}},"geojson_properties":{"GID_1":"NLD.12_1","GID_0":"NLD","COUNTRY":"Netherlands","NAME_1":"Zeeland","VARNAME_1":"Zelanda|Zélande|Zelândia","NL_NAME_1":"NA","TYPE_1":"Provincie","ENGTYPE_1":"Province","CC_1":"NA","HASC_1":"NL.ZE","ISO_1":"NL-ZE"}},{"id":"NLD.13_1","name":"Zeeuwse meren","bounds":{"min":{"lng":3.6273,"lat":51.4317},"max":{"lng":4.4114,"lat":51.7737}},"geojson_properties":{"GID_1":"NLD.13_1","GID_0":"NLD","COUNTRY":"Netherlands","NAME_1":"Zeeuwse meren","VARNAME_1":"NA","NL_NAME_1":"NA","TYPE_1":"Waterbody","ENGTYPE_1":"Waterbody","CC_1":"NA","HASC_1":"NA","ISO_1":"NA"}},{"id":"NLD.14_1","name":"Zuid-Holland","bounds":{"min":{"lng":3.8397,"lat":51.6439},"max":{"lng":5.036,"lat":52.3277}},"geojson_properties":{"GID_1":"NLD.14_1","GID_0":"NLD","COUNTRY":"Netherlands","NAME_1":"Zuid-Holland","VARNAME_1":"NA","NL_NAME_1":"NA","TYPE_1":"NA","ENGTYPE_1":"NA","CC_1":"NA","HASC_1":"NA","ISO_1":"NA"}}]
