[{"id":"BRA.1_1","name":"Acre","bounds":{"min":{"lng":-73.9897,"lat":-11.1452},"max":{"lng":-66.5888,"lat":-7.1142}},"geojson_properties":{"GID_1":"BRA.1_1","GID_0":"BRA","COUNTRY":"Brazil","NAME_1":"Acre","VARNAME_1":"NA","NL_NAME_1":"NA","TYPE_1":"Estado","ENGTYPE_1":"State","CC_1":"NA","HASC_1":"BR.AC","ISO_1":"BR-AC"}},{"id":"BRA.2_1","name":"Alagoas","bounds":{"min":{"lng":-38.2376,"lat":-10.5003},"max":{"lng":-35.1519,"lat":-8.8131}},"geojson_properties":{"GID_1":"BRA.2_1","GID_0":"BRA","COUNTRY":"Brazil","NAME_1":"Alagoas","VARNAME_1":"NA","NL_NAME_1":"NA","TYPE_1":"Estado","ENGTYPE_1":"State","CC_1":"NA","HASC_1":"BR.AL","ISO_1":"BR-AL"}},{"id":"BRA.3_1","name":"Amapá","bounds":{"min":{"lng":-54.8763,"lat":-1.2362},"max":{"lng":-49.8758,"lat":4.4749}},"geojson_properties":{"GID_1":"BRA.3_1","GID_0":"BRA","COUNTRY":"Brazil","NAME_1":"Amapá","VARNAME_1":"NA","NL_NAME_1":"NA","TYPE_1":"Estado","ENGTYPE_1":"State","CC_1":"NA","HASC_1":"BR.AP","ISO_1":"NA"}},{"id":"BRA.4_1","name":"Amazonas","bounds":{"min":{"lng":-73.7957,"lat":-9.818},"max":{"lng":-56.0976,"lat":2.2299}},"geojson_properties":{"GID_1":"BRA.4_1","GID_0":"BRA","COUNTRY":"Brazil","NAME_1":"Amazonas","VARNAME_1":"Amazone","NL_NAME_1":"NA","TYPE_1":"Estado","ENGTYPE_1":"State","CC_1":"NA","HASC_1":"BR.AM","ISO_1":"BR-AM"}},{"id":"BRA.5_1","name":"Bahia","bounds":{"min":{"lng":-46.5772,"lat":-18.3486},"max":{"lng":-37.3411,"lat":-8.5328}},"geojson_properties":{"GID_1":"BRA.5_1","GID_0":"BRA","COUNTRY":"Brazil","NAME_1":"Bahia","VARNAME_1":"Ba¡a","NL_NAME_1":"NA","TYPE_1":"Estado","ENGTYPE_1":"State","CC_1":"NA","HASC_1":"BR.BA","ISO_1":"BR-BA"}},{"id":"BRA.6_1","name":"Ceará","bounds":{"min":{"lng":-41.4235,"lat":-7.8582},"max":{"lng":-37.2527,"lat":-2.7843}},"geojson_properties":{"GID_1":"BRA.6_1","GID_0":"BRA","COUNTRY":"Brazil","NAME_1":"Ceará","VARNAME_1":"NA","NL_NAME_1":"NA","TYPE_1":"Estado","ENGTYPE_1":"State","CC_1":"NA","HASC_1":"BR.CE","ISO_1":"NA"}},{"id":"BRA.7_1","name":"Distrito Federal","bounds":{"min":{"lng":-48.2858,"lat":-16.05},"max":{"lng":-47.3085,"lat":-15.5018}},"geojson_properties":{"GID_1":"BRA.7_1","GID_0":"BRA","COUNTRY":"Brazil","NAME_1":"Distrito Federal","VARNAME_1":"NA","NL_NAME_1":"NA","TYPE_1":"DistritoFederal","ENGTYPE_1":"FederalDistrict","CC_1":"NA","HASC_1":"BR.DF","ISO_1":"BR-DF"}},{"id":"BRA.8_1","name":"Espírito Santo","bounds":{"min":{"lng":-41.8798,"lat":-21.3018},"max":{"lng":-28.8477,"lat":-17.8919}},"geojson_properties":{"GID_1":"BRA.8_1","GID_0":"BRA","COUNTRY":"Brazil","NAME_1":"Espírito Santo","VARNAME_1":"EspirituSanto","NL_NAME_1":"NA","TYPE_1":"Estado","ENGTYPE_1":"State","CC_1":"NA","HASC_1":"BR.ES","ISO_1":"NA"}},{"id":"BRA.9_1","name":"Goiás","bounds":{"min":{"lng":-53.2485,"lat":-19.4984},"max":{"lng":-45.9072,"lat":-12.3954}},"geojson_properties":{"GID_1":"BRA.9_1","GID_0":"BRA","COUNTRY":"Brazil","NAME_1":"Goiás","VARNAME_1":"Goiáz|Goyáz","NL_NAME_1":"NA","TYPE_1":"Estado","ENGTYPE_1":"State","CC_1":"NA","HASC_1":"BR.GO","ISO_1":"NA"}},{"id":"BRA.10_1","name":"Maranhão","bounds":{"min":{"lng":-48.7552,"lat":-10.2618},"max":{"lng":-41.7963,"lat":-1.0495}},"geojson_properties":{"GID_1":"BRA.10_1","GID_0":"BRA","COUNTRY":"Brazil","NAME_1":"Maranhão","VARNAME_1":"SãoLuízdeMaranhão","NL_NAME_1":"NA","TYPE_1":"Estado","ENGTYPE_1":"State","CC_1":"NA","HASC_1":"BR.MA","ISO_1":"NA"}},{"id":"BRA.12_1","name":"Mato Grosso","bounds":{"min":{"lng":-61.6333,"lat":-18.0416},"max":{"lng":-50.2248,"lat":-7.349}},"geojson_properties":{"GID_1":"BRA.12_1","GID_0":"BRA","COUNTRY":"Brazil","NAME_1":"Mato Grosso","VARNAME_1":"MattoGrosso","NL_NAME_1":"NA","TYPE_1":"Estado","ENGTYPE_1":"State","CC_1":"NA","HASC_1":"BR.MT","ISO_1":"BR-MT"}},{"id":"BRA.11_1","name":"Mato Grosso do Sul","bounds":{"min":{"lng":-58.1628,"lat":-24.0674},"max":{"lng":-50.9229,"lat":-17.1663}},"geojson_properties":{"GID_1":"BRA.11_1","GID_0":"BRA","COUNTRY":"Brazil","NAME_1":"Mato Grosso do Sul","VARNAME_1":"NA","NL_NAME_1":"NA","TYPE_1":"Estado","ENGTYPE_1":"State","CC_1":"NA","HASC_1":"BR.MS","ISO_1":"BR-MS"}},{"id":"BRA.13_1","name":"Minas Gerais","bounds":{"min":{"lng":-51.0459,"lat":-22.9228},"max":{"lng":-39.8568,"lat":-14.2332}},"geojson_properties":{"GID_1":"BRA.13_1","GID_0":"BRA","COUNTRY":"Brazil","NAME_1":"Minas Gerais","VARNAME_1":"Minas|MinasGeraes","NL_NAME_1":"NA","TYPE_1":"Estado","ENGTYPE_1":"State","CC_1":"NA","HASC_1":"BR.MG","ISO_1":"BR-MG"}},{"id":"BRA.14_1","name":"Pará","bounds":{"min":{"lng":-58.8983,"lat":-9.8412},"max":{"lng":-46.0615,"lat":2.6325}},"geojson_properties":{"GID_1":"BRA.14_1","GID_0":"BRA","COUNTRY":"Brazil","NAME_1":"Pará","VARNAME_1":"NA","NL_NAME_1":"NA","TYPE_1":"Estado","ENGTYPE_1":"State","CC_1":"NA","HASC_1":"BR.PA","ISO_1":"NA"}},{"id":"BRA.15_1","name":"Paraíba","bounds":{"min":{"lng":-38.7656,"lat":-8.303},"max":{"lng":-34.7931,"lat":-6.0266}},"geojson_properties":{"GID_1":"BRA.15_1","GID_0":"BRA","COUNTRY":"Brazil","NAME_1":"Paraíba","VARNAME_1":"Parahyba","NL_NAME_1":"NA","TYPE_1":"Estado","ENGTYPE_1":"State","CC_1":"NA","HASC_1":"BR.PB","ISO_1":"NA"}},{"id":"BRA.16_1","name":"Paraná","bounds":{"min":{"lng":-54.616,"lat":-26.7171},"max":{"lng":-48.0235,"lat":-22.5167}},"geojson_properties":{"GID_1":"BRA.16_1","GID_0":"BRA","COUNTRY":"Brazil","NAME_1":"Paraná","VARNAME_1":"NA","NL_NAME_1":"NA","TYPE_1":"Estado","ENGTYPE_1":"State","CC_1":"NA","HASC_1":"BR.PR","ISO_1":"NA"}},{"id":"BRA.17_1","name":"Pernambuco","bounds":{"min":{"lng":-41.3583,"lat":-9.4827},"max":{"lng":-32.3778,"lat":-3.8046}},"geojson_properties":{"GID_1":"BRA.17_1","GID_0":"BRA","COUNTRY":"Brazil","NAME_1":"Pernambuco","VARNAME_1":"Pernambouc","NL_NAME_1":"NA","TYPE_1":"Estado","ENGTYPE_1":"State","CC_1":"NA","HASC_1":"BR.PE","ISO_1":"BR-PE"}},{"id":"BRA.18_1","name":"Piauí","bounds":{"min":{"lng":-46.0282,"lat":-10.9288},"max":{"lng":-40.3705,"lat":-2.7504}},"geojson_properties":{"GID_1":"BRA.18_1","GID_0":"BRA","COUNTRY":"Brazil","NAME_1":"Piauí","VARNAME_1":"Piauhy","NL_NAME_1":"NA","TYPE_1":"Estado","ENGTYPE_1":"State","CC_1":"NA","HASC_1":"BR.PI","ISO_1":"NA"}},{"id":"BRA.19_1","name":"Rio de Janeiro","bounds":{"min":{"lng":-44.8889,"lat":-23.3689},"max":{"lng":-40.9579,"lat":-20.7632}},"geojson_properties":{"GID_1":"BRA.19_1","GID_0":"BRA","COUNTRY":"Brazil","NAME_1":"Rio de Janeiro","VARNAME_1":"NA","NL_NAME_1":"NA","TYPE_1":"Estado","ENGTYPE_1":"State","CC_1":"NA","HASC_1":"BR.RJ","ISO_1":"BR-RJ"}},{"id":"BRA.20_1","name":"Rio Grande do Norte","bounds":{"min":{"lng":-38.5821,"lat":-6.9827},"max":{"lng":-34.9685,"lat":-4.8164}},"geojson_properties":{"GID_1":"BRA.20_1","GID_0":"BRA","COUNTRY":"Brazil","NAME_1":"Rio Grande do Norte","VARNAME_1":"NA","NL_NAME_1":"NA","TYPE_1":"Estado","ENGTYPE_1":"State","CC_1":"NA","HASC_1":"BR.RN","ISO_1":"BR-RN"}},{"id":"BRA.21_1","name":"Rio Grande do Sul","bounds":{"min":{"lng":-57.6455,"lat":-33.7463},"max":{"lng":-49.6918,"lat":-27.0823}},"geojson_properties":{"GID_1":"BRA.21_1","GID_0":"BRA","COUNTRY":"Brazil","NAME_1":"Rio Grande do Sul","VARNAME_1":"NA","NL_NAME_1":"NA","TYPE_1":"Estado","ENGTYPE_1":"State","CC_1":"NA","HASC_1":"BR.RS","ISO_1":"BR-RS"}},{"id":"BRA.22_1","name":"Rondônia","bounds":{"min":{"lng":-66.8103,"lat":-13.6907},"max":{"lng":-59.7744,"lat":-7.9759}},"geojson_properties":{"GID_1":"BRA.22_1","GID_0":"BRA","COUNTRY":"Brazil","NAME_1":"Rondônia","VARNAME_1":"Guaporé","NL_NAME_1":"NA","TYPE_1":"Estado","ENGTYPE_1":"State","CC_1":"NA","HASC_1":"BR.RO","ISO_1":"NA"}},{"id":"BRA.23_1","name":"Roraima","bounds":{"min":{"lng":-64.825,"lat":-1.5806},"max":{"lng":-58.8918,"lat":5.2649}},"geojson_properties":{"GID_1":"BRA.23_1","GID_0":"BRA","COUNTRY":"Brazil","NAME_1":"Roraima","VARNAME_1":"RioBranco","NL_NAME_1":"NA","TYPE_1":"Estado","ENGTYPE_1":"State","CC_1":"NA","HASC_1":"BR.RR","ISO_1":"BR-RR"}},{"id":"BRA.24_1","name":"Santa Catarina","bounds":{"min":{"lng":-53.8371,"lat":-29.3551},"max":{"lng":-48.3279,"lat":-25.9558}},"geojson_properties":{"GID_1":"BRA.24_1","GID_0":"BRA","COUNTRY":"Brazil","NAME_1":"Santa Catarina","VARNAME_1":"SantaCatharina","NL_NAME_1":"NA","TYPE_1":"Estado","ENGTYPE_1":"State","CC_1":"NA","HASC_1":"BR.SC","ISO_1":"BR-SC"}},{"id":"BRA.25_1","name":"São Paulo","bounds":{"min":{"lng":-53.1099,"lat":-25.358},"max":{"lng":-44.1614,"lat":-19.7799}},"geojson_properties":{"GID_1":"BRA.25_1","GID_0":"BRA","COUNTRY":"Brazil","NAME_1":"São Paulo","VARNAME_1":"NA","NL_NAME_1":"NA","TYPE_1":"Estado","ENGTYPE_1":"State","CC_1":"NA","HASC_1":"BR.SP","ISO_1":"NA"}},{"id":"BRA.26_1","name":"Sergipe","bounds":{"min":{"lng":-38.245,"lat":-11.5685},"max":{"lng":-36.3959,"lat":-9.515}},"geojson_properties":{"GID_1":"BRA.26_1","GID_0":"BRA","COUNTRY":"Brazil","NAME_1":"Sergipe","VARNAME_1":"NA","NL_NAME_1":"NA","TYPE_1":"Estado","ENGTYPE_1":"State","CC_1":"NA","HASC_1":"BR.SE","ISO_1":"BR-SE"}},{"id":"BRA.27_1","name":"Tocantins","bounds":{"min":{"lng":-50.7421,"lat":-13.4682},"max":{"lng":-45.6996,"lat":-5.1686}},"geojson_properties":{"GID_1":"BRA.27_1","GID_0":"BRA","COUNTRY":"Brazil","NAME_1":"Tocantins","VARNAME_1":"NA","NL_NAME_1":"NA","TYPE_1":"Estado","ENGTYPE_1":"State","CC_1":"NA","HASC_1":"BR.TO","ISO_1":"BR-TO"}}]
