[{"id":"NOR.1_1","name":"Akershus","bounds":{"min":{"lng":10.3247,"lat":59.4808},"max":{"lng":11.9273,"lat":60.5955}},"geojson_properties":{"GID_1":"NOR.1_1","GID_0":"NOR","COUNTRY":"Norway","NAME_1":"Akershus","VARNAME_1":"Akershusfylke","NL_NAME_1":"NA","TYPE_1":"Fylke","ENGTYPE_1":"County","CC_1":"NA","HASC_1":"NO.AK","ISO_1":"NA"}},{"id":"NOR.2_1","name":"Ãstfold","bounds":{"min":{"lng":10.5764,"lat":58.8764},"max":{"lng":11.9424,"lat":59.7885}},"geojson_properties":{"GID_1":"NOR.2_1","GID_0":"NOR","COUNTRY":"Norway","NAME_1":"Ãstfold","VARNAME_1":"Oestfoldfylke","NL_NAME_1":"NA","TYPE_1":"Fylke","ENGTYPE_1":"County","CC_1":"NA","HASC_1":"NO.OF","ISO_1":"NA"}},{"id":"NOR.3_1","name":"Aust-Agder","bounds":{"min":{"lng":6.8225,"lat":58.1079},"max":{"lng":9.366,"lat":59.678}},"geojson_properties":{"GID_1":"NOR.3_1","GID_0":"NOR","COUNTRY":"Norway","NAME_1":"Aust-Agder","VARNAME_1":"Aust-Agderfylke|Austur-Agðir|Ne","NL_NAME_1":"NA","TYPE_1":"Fylke","ENGTYPE_1":"County","CC_1":"NA","HASC_1":"NO.AA","ISO_1":"NA"}},{"id":"NOR.4_1","name":"Buskerud","bounds":{"min":{"lng":7.4645,"lat":59.4056},"max":{"lng":10.6192,"lat":61.0905}},"geojson_properties":{"GID_1":"NOR.4_1","GID_0":"NOR","COUNTRY":"Norway","NAME_1":"Buskerud","VARNAME_1":"Buskerudfylke","NL_NAME_1":"NA","TYPE_1":"Fylke","ENGTYPE_1":"County","CC_1":"NA","HASC_1":"NO.BU","ISO_1":"NA"}},{"id":"NOR.5_1","name":"Finnmark","bounds":{"min":{"lng":21.1755,"lat":68.5544},"max":{"lng":31.162,"lat":71.1813}},"geojson_properties":{"GID_1":"NOR.5_1","GID_0":"NOR","COUNTRY":"Norway","NAME_1":"Finnmark","VARNAME_1":"Finnmarkfylke|Finmarken|Finnmár","NL_NAME_1":"NA","TYPE_1":"Fylke","ENGTYPE_1":"County","CC_1":"NA","HASC_1":"NO.FI","ISO_1":"NA"}},{"id":"NOR.6_1","name":"Hedmark","bounds":{"min":{"lng":9.5848,"lat":59.842},"max":{"lng":12.875,"lat":62.6986}},"geojson_properties":{"GID_1":"NOR.6_1","GID_0":"NOR","COUNTRY":"Norway","NAME_1":"Hedmark","VARNAME_1":"Hedmarkfylke|Hedemarken|Heiðmör","NL_NAME_1":"NA","TYPE_1":"Fylke","ENGTYPE_1":"County","CC_1":"NA","HASC_1":"NO.HE","ISO_1":"NA"}},{"id":"NOR.7_1","name":"Hordaland","bounds":{"min":{"lng":3.9047,"lat":59.4867},"max":{"lng":7.7131,"lat":61.0334}},"geojson_properties":{"GID_1":"NOR.7_1","GID_0":"NOR","COUNTRY":"Norway","NAME_1":"Hordaland","VARNAME_1":"Hordalandfylke|Hörðaland|Søndre","NL_NAME_1":"NA","TYPE_1":"Fylke","ENGTYPE_1":"County","CC_1":"NA","HASC_1":"NO.HO","ISO_1":"NA"}},{"id":"NOR.8_1","name":"Møre og Romsdal","bounds":{"min":{"lng":5.3438,"lat":61.9515},"max":{"lng":9.5851,"lat":63.5307}},"geojson_properties":{"GID_1":"NOR.8_1","GID_0":"NOR","COUNTRY":"Norway","NAME_1":"Møre og Romsdal","VARNAME_1":"MoereogRomsdalfylk|Møre|Romsd","NL_NAME_1":"NA","TYPE_1":"Fylke","ENGTYPE_1":"County","CC_1":"NA","HASC_1":"NO.MR","ISO_1":"NA"}},{"id":"NOR.9_1","name":"Nord-Trøndelag","bounds":{"min":{"lng":10.13,"lat":63.1782},"max":{"lng":14.3114,"lat":65.3411}},"geojson_properties":{"GID_1":"NOR.9_1","GID_0":"NOR","COUNTRY":"Norway","NAME_1":"Nord-Trøndelag","VARNAME_1":"Nord-Troendelagfylke|NordreTro","NL_NAME_1":"NA","TYPE_1":"Fylke","ENGTYPE_1":"County","CC_1":"NA","HASC_1":"NO.NT","ISO_1":"NA"}},{"id":"NOR.10_1","name":"Nordland","bounds":{"min":{"lng":11.3818,"lat":64.9418},"max":{"lng":18.1545,"lat":69.325}},"geojson_properties":{"GID_1":"NOR.10_1","GID_0":"NOR","COUNTRY":"Norway","NAME_1":"Nordland","VARNAME_1":"Nordlandfylke","NL_NAME_1":"NA","TYPE_1":"Fylke","ENGTYPE_1":"County","CC_1":"NA","HASC_1":"NO.NO","ISO_1":"NO-18"}},{"id":"NOR.11_1","name":"Oppland","bounds":{"min":{"lng":7.3466,"lat":60.1218},"max":{"lng":11.1622,"lat":62.3818}},"geojson_properties":{"GID_1":"NOR.11_1","GID_0":"NOR","COUNTRY":"Norway","NAME_1":"Oppland","VARNAME_1":"Opplandfylke|Kristian|Opland|Up","NL_NAME_1":"NA","TYPE_1":"Fylke","ENGTYPE_1":"County","CC_1":"NA","HASC_1":"NO.OP","ISO_1":"NA"}},{"id":"NOR.12_1","name":"Oslo","bounds":{"min":{"lng":10.5003,"lat":59.8075},"max":{"lng":10.9397,"lat":60.132}},"geojson_properties":{"GID_1":"NOR.12_1","GID_0":"NOR","COUNTRY":"Norway","NAME_1":"Oslo","VARNAME_1":"Oslofylke|Kristiania","NL_NAME_1":"NA","TYPE_1":"Fylke","ENGTYPE_1":"County","CC_1":"NA","HASC_1":"NO.OS","ISO_1":"NO-03"}},{"id":"NOR.13_1","name":"Rogaland","bounds":{"min":{"lng":4.8447,"lat":58.2704},"max":{"lng":7.1922,"lat":59.8437}},"geojson_properties":{"GID_1":"NOR.13_1","GID_0":"NOR","COUNTRY":"Norway","NAME_1":"Rogaland","VARNAME_1":"Rogalandfylke|Stavanger","NL_NAME_1":"NA","TYPE_1":"Fylke","ENGTYPE_1":"County","CC_1":"NA","HASC_1":"NO.RO","ISO_1":"NO-11"}},{"id":"NOR.14_1","name":"Sogn og Fjordane","bounds":{"min":{"lng":4.5089,"lat":60.6712},"max":{"lng":8.3295,"lat":62.2104}},"geojson_properties":{"GID_1":"NOR.14_1","GID_0":"NOR","COUNTRY":"Norway","NAME_1":"Sogn og Fjordane","VARNAME_1":"SognogFjordanefyl|NordreBerg","NL_NAME_1":"NA","TYPE_1":"Fylke","ENGTYPE_1":"County","CC_1":"NA","HASC_1":"NO.SF","ISO_1":"NA"}},{"id":"NOR.15_1","name":"Sør-Trøndelag","bounds":{"min":{"lng":8.2375,"lat":62.2547},"max":{"lng":12.2541,"lat":64.425}},"geojson_properties":{"GID_1":"NOR.15_1","GID_0":"NOR","COUNTRY":"Norway","NAME_1":"Sør-Trøndelag","VARNAME_1":"Soer-Troendelagfylke|SøndreTro","NL_NAME_1":"NA","TYPE_1":"Fylke","ENGTYPE_1":"County","CC_1":"NA","HASC_1":"NO.ST","ISO_1":"NA"}},{"id":"NOR.16_1","name":"Telemark","bounds":{"min":{"lng":7.095,"lat":58.7637},"max":{"lng":9.8796,"lat":60.1972}},"geojson_properties":{"GID_1":"NOR.16_1","GID_0":"NOR","COUNTRY":"Norway","NAME_1":"Telemark","VARNAME_1":"Telemarkfylke|Bratsberg|Þelamör","NL_NAME_1":"NA","TYPE_1":"Fylke","ENGTYPE_1":"County","CC_1":"NA","HASC_1":"NO.TE","ISO_1":"NA"}},{"id":"NOR.17_1","name":"Troms","bounds":{"min":{"lng":15.595,"lat":68.3569},"max":{"lng":22.8833,"lat":70.3083}},"geojson_properties":{"GID_1":"NOR.17_1","GID_0":"NOR","COUNTRY":"Norway","NAME_1":"Troms","VARNAME_1":"Tromsfylke|Tromsø|Troms-Fylki","NL_NAME_1":"NA","TYPE_1":"Fylke","ENGTYPE_1":"County","CC_1":"NA","HASC_1":"NO.TR","ISO_1":"NA"}},{"id":"NOR.18_1","name":"Vest-Agder","bounds":{"min":{"lng":6.3944,"lat":57.959},"max":{"lng":8.2096,"lat":59.1945}},"geojson_properties":{"GID_1":"NOR.18_1","GID_0":"NOR","COUNTRY":"Norway","NAME_1":"Vest-Agder","VARNAME_1":"Vest-Agderfylke|ListerogManda","NL_NAME_1":"NA","TYPE_1":"Fylke","ENGTYPE_1":"County","CC_1":"NA","HASC_1":"NO.VA","ISO_1":"NA"}},{"id":"NOR.19_1","name":"Vestfold","bounds":{"min":{"lng":9.7505,"lat":58.9368},"max":{"lng":10.5953,"lat":59.6924}},"geojson_properties":{"GID_1":"NOR.19_1","GID_0":"NOR","COUNTRY":"Norway","NAME_1":"Vestfold","VARNAME_1":"Vestfoldfylke|JarlsbergogLarv","NL_NAME_1":"NA","TYPE_1":"Fylke","ENGTYPE_1":"County","CC_1":"NA","HASC_1":"NO.VF","ISO_1":"NA"}}]
