[{"id":"MYT.1_1","name":"Acoua","bounds":{"min":{"lng":45.0393,"lat":-12.7472},"max":{"lng":45.0964,"lat":-12.7006}},"geojson_properties":{"GID_1":"MYT.1_1","GID_0":"MYT","COUNTRY":"Mayotte","NAME_1":"Acoua","VARNAME_1":"NA","NL_NAME_1":"NA","TYPE_1":"Chef-lieucanton","ENGTYPE_1":"Commune","CC_1":"01","HASC_1":"NA","ISO_1":"NA"}},{"id":"MYT.2_1","name":"Bandraboua","bounds":{"min":{"lng":45.0893,"lat":-12.762},"max":{"lng":45.1586,"lat":-12.6721}},"geojson_properties":{"GID_1":"MYT.2_1","GID_0":"MYT","COUNTRY":"Mayotte","NAME_1":"Bandraboua","VARNAME_1":"NA","NL_NAME_1":"NA","TYPE_1":"Chef-lieucanton","ENGTYPE_1":"Commune","CC_1":"02","HASC_1":"NA","ISO_1":"-"}},{"id":"MYT.3_1","name":"Bandrele","bounds":{"min":{"lng":45.1409,"lat":-12.996},"max":{"lng":45.2346,"lat":-12.8712}},"geojson_properties":{"GID_1":"MYT.3_1","GID_0":"MYT","COUNTRY":"Mayotte","NAME_1":"Bandrele","VARNAME_1":"NA","NL_NAME_1":"NA","TYPE_1":"Chef-lieucanton","ENGTYPE_1":"Commune","CC_1":"03","HASC_1":"NA","ISO_1":"-"}},{"id":"MYT.4_1","name":"Boueni","bounds":{"min":{"lng":45.0704,"lat":-12.9637},"max":{"lng":45.1264,"lat":-12.8971}},"geojson_properties":{"GID_1":"MYT.4_1","GID_0":"MYT","COUNTRY":"Mayotte","NAME_1":"Boueni","VARNAME_1":"NA","NL_NAME_1":"NA","TYPE_1":"Chef-lieucanton","ENGTYPE_1":"Commune","CC_1":"04","HASC_1":"NA","ISO_1":"NA"}},{"id":"MYT.5_1","name":"Chiconi","bounds":{"min":{"lng":45.0993,"lat":-12.8413},"max":{"lng":45.1257,"lat":-12.8016}},"geojson_properties":{"GID_1":"MYT.5_1","GID_0":"MYT","COUNTRY":"Mayotte","NAME_1":"Chiconi","VARNAME_1":"NA","NL_NAME_1":"NA","TYPE_1":"Chef-lieucanton","ENGTYPE_1":"Commune","CC_1":"05","HASC_1":"NA","ISO_1":"NA"}},{"id":"MYT.6_1","name":"Chirongui","bounds":{"min":{"lng":45.1195,"lat":-12.9656},"max":{"lng":45.1667,"lat":-12.8694}},"geojson_properties":{"GID_1":"MYT.6_1","GID_0":"MYT","COUNTRY":"Mayotte","NAME_1":"Chirongui","VARNAME_1":"NA","NL_NAME_1":"NA","TYPE_1":"Chef-lieucanton","ENGTYPE_1":"Commune","CC_1":"06","HASC_1":"NA","ISO_1":"NA"}},{"id":"MYT.7_1","name":"Dembeni","bounds":{"min":{"lng":45.1393,"lat":-12.8868},"max":{"lng":45.2546,"lat":-12.8199}},"geojson_properties":{"GID_1":"MYT.7_1","GID_0":"MYT","COUNTRY":"Mayotte","NAME_1":"Dembeni","VARNAME_1":"NA","NL_NAME_1":"NA","TYPE_1":"Chef-lieucanton","ENGTYPE_1":"Commune","CC_1":"07","HASC_1":"NA","ISO_1":"NA"}},{"id":"MYT.8_1","name":"Dzaoudzi","bounds":{"min":{"lng":45.2485,"lat":-12.7929},"max":{"lng":45.2999,"lat":-12.7485}},"geojson_properties":{"GID_1":"MYT.8_1","GID_0":"MYT","COUNTRY":"Mayotte","NAME_1":"Dzaoudzi","VARNAME_1":"NA","NL_NAME_1":"NA","TYPE_1":"Préfecturederégion","ENGTYPE_1":"Commune","CC_1":"08","HASC_1":"NA","ISO_1":"NA"}},{"id":"MYT.9_1","name":"Kani-Keli","bounds":{"min":{"lng":45.0793,"lat":-13.0063},"max":{"lng":45.1585,"lat":-12.9439}},"geojson_properties":{"GID_1":"MYT.9_1","GID_0":"MYT","COUNTRY":"Mayotte","NAME_1":"Kani-Keli","VARNAME_1":"NA","NL_NAME_1":"NA","TYPE_1":"Chef-lieucanton","ENGTYPE_1":"Commune","CC_1":"09","HASC_1":"NA","ISO_1":"-"}},{"id":"MYT.10_1","name":"Koungou","bounds":{"min":{"lng":45.1451,"lat":-12.7653},"max":{"lng":45.2376,"lat":-12.7176}},"geojson_properties":{"GID_1":"MYT.10_1","GID_0":"MYT","COUNTRY":"Mayotte","NAME_1":"Koungou","VARNAME_1":"NA","NL_NAME_1":"NA","TYPE_1":"Chef-lieucanton","ENGTYPE_1":"Commune","CC_1":"10","HASC_1":"NA","ISO_1":"NA"}},{"id":"MYT.11_1","name":"M'tsangamouji","bounds":{"min":{"lng":45.0424,"lat":-12.7793},"max":{"lng":45.126,"lat":-12.7324}},"geojson_properties":{"GID_1":"MYT.11_1","GID_0":"MYT","COUNTRY":"Mayotte","NAME_1":"M'tsangamouji","VARNAME_1":"NA","NL_NAME_1":"NA","TYPE_1":"Chef-lieucanton","ENGTYPE_1":"Commune","CC_1":"13","HASC_1":"NA","ISO_1":"NA"}},{"id":"MYT.12_1","name":"Mamoudzou","bounds":{"min":{"lng":45.1526,"lat":-12.8222},"max":{"lng":45.241,"lat":-12.7539}},"geojson_properties":{"GID_1":"MYT.12_1","GID_0":"MYT","COUNTRY":"Mayotte","NAME_1":"Mamoudzou","VARNAME_1":"NA","NL_NAME_1":"NA","TYPE_1":"Sous-préfecture","ENGTYPE_1":"Commune","CC_1":"11","HASC_1":"NA","ISO_1":"-"}},{"id":"MYT.13_1","name":"Mtsamboro","bounds":{"min":{"lng":45.0179,"lat":-12.7156},"max":{"lng":45.1074,"lat":-12.636}},"geojson_properties":{"GID_1":"MYT.13_1","GID_0":"MYT","COUNTRY":"Mayotte","NAME_1":"Mtsamboro","VARNAME_1":"NA","NL_NAME_1":"NA","TYPE_1":"Chef-lieucanton","ENGTYPE_1":"Commune","CC_1":"12","HASC_1":"NA","ISO_1":"NA"}},{"id":"MYT.14_1","name":"Ouangani","bounds":{"min":{"lng":45.1216,"lat":-12.874},"max":{"lng":45.1547,"lat":-12.804}},"geojson_properties":{"GID_1":"MYT.14_1","GID_0":"MYT","COUNTRY":"Mayotte","NAME_1":"Ouangani","VARNAME_1":"NA","NL_NAME_1":"NA","TYPE_1":"Chef-lieucanton","ENGTYPE_1":"Commune","CC_1":"14","HASC_1":"NA","ISO_1":"-"}},{"id":"MYT.15_1","name":"Pamandzi","bounds":{"min":{"lng":45.2703,"lat":-12.8185},"max":{"lng":45.2971,"lat":-12.7844}},"geojson_properties":{"GID_1":"MYT.15_1","GID_0":"MYT","COUNTRY":"Mayotte","NAME_1":"Pamandzi","VARNAME_1":"NA","NL_NAME_1":"NA","TYPE_1":"Chef-lieucanton","ENGTYPE_1":"Commune","CC_1":"15","HASC_1":"NA","ISO_1":"-"}},{"id":"MYT.16_1","name":"Sada","bounds":{"min":{"lng":45.0918,"lat":-12.889},"max":{"lng":45.1384,"lat":-12.8399}},"geojson_properties":{"GID_1":"MYT.16_1","GID_0":"MYT","COUNTRY":"Mayotte","NAME_1":"Sada","VARNAME_1":"NA","NL_NAME_1":"NA","TYPE_1":"Chef-lieucanton","ENGTYPE_1":"Commune","CC_1":"16","HASC_1":"NA","ISO_1":"-"}},{"id":"MYT.17_1","name":"Tsingoni","bounds":{"min":{"lng":45.0929,"lat":-12.81},"max":{"lng":45.1731,"lat":-12.7539}},"geojson_properties":{"GID_1":"MYT.17_1","GID_0":"MYT","COUNTRY":"Mayotte","NAME_1":"Tsingoni","VARNAME_1":"NA","NL_NAME_1":"NA","TYPE_1":"Chef-lieucanton","ENGTYPE_1":"Commune","CC_1":"17","HASC_1":"NA","ISO_1":"NA"}}]
