[{"id":"MRT.1_1","name":"Adrar","bounds":{"min":{"lng":-14.3012,"lat":18.5571},"max":{"lng":-6.3548,"lat":24.3067}},"geojson_properties":{"GID_1":"MRT.1_1","GID_0":"MRT","COUNTRY":"Mauritania","NAME_1":"Adrar","VARNAME_1":"NA","NL_NAME_1":"NA","TYPE_1":"Wilayat|Région","ENGTYPE_1":"Region","CC_1":"NA","HASC_1":"MR.AD","ISO_1":"MR-07"}},{"id":"MRT.2_1","name":"Assaba","bounds":{"min":{"lng":-12.839,"lat":15.1036},"max":{"lng":-10.5846,"lat":18.311}},"geojson_properties":{"GID_1":"MRT.2_1","GID_0":"MRT","COUNTRY":"Mauritania","NAME_1":"Assaba","VARNAME_1":"Açaba|el-`Açâba","NL_NAME_1":"NA","TYPE_1":"Wilayat|Région","ENGTYPE_1":"Region","CC_1":"NA","HASC_1":"MR.AS","ISO_1":"MR-03"}},{"id":"MRT.3_1","name":"Brakna","bounds":{"min":{"lng":-14.9546,"lat":16.1064},"max":{"lng":-12.3102,"lat":18.5571}},"geojson_properties":{"GID_1":"MRT.3_1","GID_0":"MRT","COUNTRY":"Mauritania","NAME_1":"Brakna","VARNAME_1":"NA","NL_NAME_1":"NA","TYPE_1":"Wilayat|Région","ENGTYPE_1":"Region","CC_1":"NA","HASC_1":"MR.BR","ISO_1":"MR-05"}},{"id":"MRT.4_1","name":"Dakhlet Nouadhibou","bounds":{"min":{"lng":-17.0665,"lat":19.4068},"max":{"lng":-14.1731,"lat":21.3436}},"geojson_properties":{"GID_1":"MRT.4_1","GID_0":"MRT","COUNTRY":"Mauritania","NAME_1":"Dakhlet Nouadhibou","VARNAME_1":"DakhletNouâdhibou|BaieduLévri","NL_NAME_1":"NA","TYPE_1":"Wilayat|Région","ENGTYPE_1":"Region","CC_1":"NA","HASC_1":"MR.DN","ISO_1":"MR-08"}},{"id":"MRT.5_1","name":"Gorgol","bounds":{"min":{"lng":-13.7199,"lat":15.1304},"max":{"lng":-12.0049,"lat":16.8584}},"geojson_properties":{"GID_1":"MRT.5_1","GID_0":"MRT","COUNTRY":"Mauritania","NAME_1":"Gorgol","VARNAME_1":"NA","NL_NAME_1":"NA","TYPE_1":"Wilayat|Région","ENGTYPE_1":"Region","CC_1":"NA","HASC_1":"MR.GO","ISO_1":"MR-04"}},{"id":"MRT.6_1","name":"Guidimaka","bounds":{"min":{"lng":-12.7468,"lat":14.7156},"max":{"lng":-11.5003,"lat":16.0562}},"geojson_properties":{"GID_1":"MRT.6_1","GID_0":"MRT","COUNTRY":"Mauritania","NAME_1":"Guidimaka","VARNAME_1":"Guidimagha|Guidimakha","NL_NAME_1":"NA","TYPE_1":"Wilayat|Région","ENGTYPE_1":"Region","CC_1":"NA","HASC_1":"MR.GD","ISO_1":"NA"}},{"id":"MRT.7_1","name":"Hodh ech Chargui","bounds":{"min":{"lng":-9.1497,"lat":15.4941},"max":{"lng":-5.3271,"lat":23.1581}},"geojson_properties":{"GID_1":"MRT.7_1","GID_0":"MRT","COUNTRY":"Mauritania","NAME_1":"Hodh ech Chargui","VARNAME_1":"EasternHodh|HodhCharghi|HodhO","NL_NAME_1":"NA","TYPE_1":"Wilayat|Région","ENGTYPE_1":"Region","CC_1":"NA","HASC_1":"MR.HC","ISO_1":"MR-01"}},{"id":"MRT.8_1","name":"Hodh el Gharbi","bounds":{"min":{"lng":-11.0958,"lat":15.3566},"max":{"lng":-8.2892,"lat":17.7229}},"geojson_properties":{"GID_1":"MRT.8_1","GID_0":"MRT","COUNTRY":"Mauritania","NAME_1":"Hodh el Gharbi","VARNAME_1":"HodhOccidental|WesternHodh","NL_NAME_1":"NA","TYPE_1":"Wilayat|Région","ENGTYPE_1":"Region","CC_1":"NA","HASC_1":"MR.HG","ISO_1":"MR-02"}},{"id":"MRT.9_1","name":"Inchiri","bounds":{"min":{"lng":-16.5446,"lat":18.9959},"max":{"lng":-14.1544,"lat":21.1508}},"geojson_properties":{"GID_1":"MRT.9_1","GID_0":"MRT","COUNTRY":"Mauritania","NAME_1":"Inchiri","VARNAME_1":"NA","NL_NAME_1":"NA","TYPE_1":"Wilayat|Région","ENGTYPE_1":"Region","CC_1":"NA","HASC_1":"MR.IN","ISO_1":"MR-12"}},{"id":"MRT.10_1","name":"Nouakchott","bounds":{"min":{"lng":-16.0504,"lat":17.8865},"max":{"lng":-15.78,"lat":18.3931}},"geojson_properties":{"GID_1":"MRT.10_1","GID_0":"MRT","COUNTRY":"Mauritania","NAME_1":"Nouakchott","VARNAME_1":"NA","NL_NAME_1":"NA","TYPE_1":"District","ENGTYPE_1":"District","CC_1":"NA","HASC_1":"MR.NO","ISO_1":"NA"}},{"id":"MRT.11_1","name":"Tagant","bounds":{"min":{"lng":-12.669,"lat":17.0804},"max":{"lng":-7.9877,"lat":19.7255}},"geojson_properties":{"GID_1":"MRT.11_1","GID_0":"MRT","COUNTRY":"Mauritania","NAME_1":"Tagant","VARNAME_1":"NA","NL_NAME_1":"NA","TYPE_1":"Wilayat|Région","ENGTYPE_1":"Region","CC_1":"NA","HASC_1":"MR.TG","ISO_1":"MR-09"}},{"id":"MRT.12_1","name":"Tiris Zemmour","bounds":{"min":{"lng":-13.1457,"lat":21.3517},"max":{"lng":-4.83,"lat":27.2981}},"geojson_properties":{"GID_1":"MRT.12_1","GID_0":"MRT","COUNTRY":"Mauritania","NAME_1":"Tiris Zemmour","VARNAME_1":"NA","NL_NAME_1":"NA","TYPE_1":"Wilayat|Région","ENGTYPE_1":"Region","CC_1":"NA","HASC_1":"MR.TZ","ISO_1":"MR-11"}},{"id":"MRT.13_1","name":"Trarza","bounds":{"min":{"lng":-16.5207,"lat":16.0617},"max":{"lng":-12.669,"lat":19.0006}},"geojson_properties":{"GID_1":"MRT.13_1","GID_0":"MRT","COUNTRY":"Mauritania","NAME_1":"Trarza","VARNAME_1":"NA","NL_NAME_1":"NA","TYPE_1":"Wilayat|Région","ENGTYPE_1":"Region","CC_1":"NA","HASC_1":"MR.TR","ISO_1":"MR-06"}}]
