[{"id":"CAN.1_1","name":"Alberta","bounds":{"min":{"lng":-120,"lat":49.0001},"max":{"lng":-110,"lat":60}},"geojson_properties":{"GID_1":"CAN.1_1","GID_0":"CAN","COUNTRY":"Canada","NAME_1":"Alberta","VARNAME_1":"NA","NL_NAME_1":"NA","TYPE_1":"Province","ENGTYPE_1":"Province","CC_1":"48","HASC_1":"CA.AB","ISO_1":"CA-AB"}},{"id":"CAN.2_1","name":"British Columbia","bounds":{"min":{"lng":-139.0522,"lat":48.3086},"max":{"lng":-114.0542,"lat":60}},"geojson_properties":{"GID_1":"CAN.2_1","GID_0":"CAN","COUNTRY":"Canada","NAME_1":"British Columbia","VARNAME_1":"Colombiebritannique|NewCaledon","NL_NAME_1":"NA","TYPE_1":"Province","ENGTYPE_1":"Province","CC_1":"59","HASC_1":"CA.BC","ISO_1":"CA-BC"}},{"id":"CAN.3_1","name":"Manitoba","bounds":{"min":{"lng":-102,"lat":49},"max":{"lng":-88.9672,"lat":60.0021}},"geojson_properties":{"GID_1":"CAN.3_1","GID_0":"CAN","COUNTRY":"Canada","NAME_1":"Manitoba","VARNAME_1":"NA","NL_NAME_1":"NA","TYPE_1":"Province","ENGTYPE_1":"Province","CC_1":"46","HASC_1":"CA.MB","ISO_1":"CA-MB"}},{"id":"CAN.4_1","name":"New Brunswick","bounds":{"min":{"lng":-69.0512,"lat":44.4833},"max":{"lng":-63.7711,"lat":48.0728}},"geojson_properties":{"GID_1":"CAN.4_1","GID_0":"CAN","COUNTRY":"Canada","NAME_1":"New Brunswick","VARNAME_1":"Nouveau-Brunswick|Acadia","NL_NAME_1":"NA","TYPE_1":"Province","ENGTYPE_1":"Province","CC_1":"13","HASC_1":"CA.NB","ISO_1":"CA-NB"}},{"id":"CAN.5_1","name":"Newfoundland and Labrador","bounds":{"min":{"lng":-67.8217,"lat":46.6103},"max":{"lng":-52.6189,"lat":62.4911}},"geojson_properties":{"GID_1":"CAN.5_1","GID_0":"CAN","COUNTRY":"Canada","NAME_1":"Newfoundland and Labrador","VARNAME_1":"Newfoundland|Terre-Neuve|Terre-N","NL_NAME_1":"NA","TYPE_1":"Province","ENGTYPE_1":"Province","CC_1":"10","HASC_1":"CA.NF","ISO_1":"CA-NL"}},{"id":"CAN.6_1","name":"Northwest Territories","bounds":{"min":{"lng":-136.4703,"lat":60},"max":{"lng":-102,"lat":78.7604}},"geojson_properties":{"GID_1":"CAN.6_1","GID_0":"CAN","COUNTRY":"Canada","NAME_1":"Northwest Territories","VARNAME_1":"TerritoiresduNord-Ouest","NL_NAME_1":"NA","TYPE_1":"Territoire","ENGTYPE_1":"Territory","CC_1":"61","HASC_1":"CA.NT","ISO_1":"CA-NT"}},{"id":"CAN.7_1","name":"Nova Scotia","bounds":{"min":{"lng":-66.3956,"lat":43.3889},"max":{"lng":-59.6428,"lat":47.2274}},"geojson_properties":{"GID_1":"CAN.7_1","GID_0":"CAN","COUNTRY":"Canada","NAME_1":"Nova Scotia","VARNAME_1":"Acadia|Nouvelle-Écosse","NL_NAME_1":"NA","TYPE_1":"Province","ENGTYPE_1":"Province","CC_1":"12","HASC_1":"CA.NS","ISO_1":"CA-NS"}},{"id":"CAN.8_1","name":"Nunavut","bounds":{"min":{"lng":-121.0492,"lat":56.4831},"max":{"lng":-61.0901,"lat":83.1104}},"geojson_properties":{"GID_1":"CAN.8_1","GID_0":"CAN","COUNTRY":"Canada","NAME_1":"Nunavut","VARNAME_1":"NA","NL_NAME_1":"NA","TYPE_1":"Territoire","ENGTYPE_1":"Territory","CC_1":"62","HASC_1":"CA.NU","ISO_1":"CA-NU"}},{"id":"CAN.9_1","name":"Ontario","bounds":{"min":{"lng":-95.156,"lat":41.6769},"max":{"lng":-74.346,"lat":56.8695}},"geojson_properties":{"GID_1":"CAN.9_1","GID_0":"CAN","COUNTRY":"Canada","NAME_1":"Ontario","VARNAME_1":"UpperCanada","NL_NAME_1":"NA","TYPE_1":"Province","ENGTYPE_1":"Province","CC_1":"35","HASC_1":"CA.ON","ISO_1":"CA-ON"}},{"id":"CAN.10_1","name":"Prince Edward Island","bounds":{"min":{"lng":-64.4136,"lat":45.9489},"max":{"lng":-61.9714,"lat":47.0588}},"geojson_properties":{"GID_1":"CAN.10_1","GID_0":"CAN","COUNTRY":"Canada","NAME_1":"Prince Edward Island","VARNAME_1":"ÎledeSaint-Jean|ÎleduPrince-","NL_NAME_1":"NA","TYPE_1":"Province","ENGTYPE_1":"Province","CC_1":"11","HASC_1":"CA.PE","ISO_1":"CA-PE"}},{"id":"CAN.11_1","name":"Québec","bounds":{"min":{"lng":-80.9911,"lat":44.9908},"max":{"lng":-57.1055,"lat":63.6979}},"geojson_properties":{"GID_1":"CAN.11_1","GID_0":"CAN","COUNTRY":"Canada","NAME_1":"Québec","VARNAME_1":"LowerCanada","NL_NAME_1":"NA","TYPE_1":"Province","ENGTYPE_1":"Province","CC_1":"24","HASC_1":"CA.QC","ISO_1":"NA"}},{"id":"CAN.12_1","name":"Saskatchewan","bounds":{"min":{"lng":-110.0078,"lat":49},"max":{"lng":-101.3625,"lat":60}},"geojson_properties":{"GID_1":"CAN.12_1","GID_0":"CAN","COUNTRY":"Canada","NAME_1":"Saskatchewan","VARNAME_1":"NA","NL_NAME_1":"NA","TYPE_1":"Province","ENGTYPE_1":"Province","CC_1":"47","HASC_1":"CA.SK","ISO_1":"CA-SK"}},{"id":"CAN.13_1","name":"Yukon","bounds":{"min":{"lng":-141.0069,"lat":60},"max":{"lng":-123.7893,"lat":71.0771}},"geojson_properties":{"GID_1":"CAN.13_1","GID_0":"CAN","COUNTRY":"Canada","NAME_1":"Yukon","VARNAME_1":"YukonTerritory|TerritoireduYu","NL_NAME_1":"NA","TYPE_1":"Territoire","ENGTYPE_1":"Territory","CC_1":"60","HASC_1":"CA.YT","ISO_1":"CA-YT"}}]
