[{"id":"PSE.1_1","name":"Gaza","bounds":{"min":{"lng":34.2293,"lat":31.2236},"max":{"lng":34.5463,"lat":31.5944}},"geojson_properties":{"GID_1":"PSE.1_1","GID_0":"PSE","COUNTRY":"Palestine","NAME_1":"Gaza","VARNAME_1":"NA","NL_NAME_1":"NA","TYPE_1":"District","ENGTYPE_1":"District","CC_1":"NA","HASC_1":"PS.GZ","ISO_1":"PS-GZA"}},{"id":"PSE.2_1","name":"West Bank","bounds":{"min":{"lng":34.8839,"lat":31.3441},"max":{"lng":35.5755,"lat":32.5516}},"geojson_properties":{"GID_1":"PSE.2_1","GID_0":"PSE","COUNTRY":"Palestine","NAME_1":"West Bank","VARNAME_1":"NA","NL_NAME_1":"NA","TYPE_1":"District","ENGTYPE_1":"District","CC_1":"NA","HASC_1":"PS.WE","ISO_1":"NA"}}]
