[{"id":"IMN.1_2","name":"Andreas","bounds":{"min":{"lng":-4.4981,"lat":54.3333},"max":{"lng":-4.4025,"lat":54.4046}},"geojson_properties":{"GID_1":"IMN.1_2","GID_0":"IMN","COUNTRY":"Isle of Man","NAME_1":"Andreas","VARNAME_1":"NA","NL_NAME_1":"NA","TYPE_1":"ParishDistrict","ENGTYPE_1":"ParishDistrict","CC_1":"NA","HASC_1":"IM.AY","ISO_1":"NA"}},{"id":"IMN.2_2","name":"Arbory & Rushen","bounds":{"min":{"lng":-4.8409,"lat":54.0365},"max":{"lng":-4.6614,"lat":54.1479}},"geojson_properties":{"GID_1":"IMN.2_2","GID_0":"IMN","COUNTRY":"Isle of Man","NAME_1":"Arbory & Rushen","VARNAME_1":"NA","NL_NAME_1":"NA","TYPE_1":"ParishDistrict","ENGTYPE_1":"ParishDistrict","CC_1":"NA","HASC_1":"IM.RU","ISO_1":"NA"}},{"id":"IMN.3_2","name":"Ballaugh","bounds":{"min":{"lng":-4.5747,"lat":54.2693},"max":{"lng":-4.5002,"lat":54.3429}},"geojson_properties":{"GID_1":"IMN.3_2","GID_0":"IMN","COUNTRY":"Isle of Man","NAME_1":"Ballaugh","VARNAME_1":"NA","NL_NAME_1":"NA","TYPE_1":"ParishDistrict","ENGTYPE_1":"ParishDistrict","CC_1":"NA","HASC_1":"IM.MC","ISO_1":"NA"}},{"id":"IMN.4_2","name":"Braddan","bounds":{"min":{"lng":-4.5664,"lat":54.1211},"max":{"lng":-4.4681,"lat":54.2665}},"geojson_properties":{"GID_1":"IMN.4_2","GID_0":"IMN","COUNTRY":"Isle of Man","NAME_1":"Braddan","VARNAME_1":"NA","NL_NAME_1":"NA","TYPE_1":"ParishDistrict","ENGTYPE_1":"ParishDistrict","CC_1":"NA","HASC_1":"IM.MD","ISO_1":"NA"}},{"id":"IMN.5_2","name":"Bride","bounds":{"min":{"lng":-4.4277,"lat":54.3491},"max":{"lng":-4.3603,"lat":54.4179}},"geojson_properties":{"GID_1":"IMN.5_2","GID_0":"IMN","COUNTRY":"Isle of Man","NAME_1":"Bride","VARNAME_1":"NA","NL_NAME_1":"NA","TYPE_1":"ParishDistrict","ENGTYPE_1":"ParishDistrict","CC_1":"NA","HASC_1":"IM.AY","ISO_1":"NA"}},{"id":"IMN.6_2","name":"Castletown","bounds":{"min":{"lng":-4.675,"lat":54.0674},"max":{"lng":-4.6332,"lat":54.0837}},"geojson_properties":{"GID_1":"IMN.6_2","GID_0":"IMN","COUNTRY":"Isle of Man","NAME_1":"Castletown","VARNAME_1":"NA","NL_NAME_1":"NA","TYPE_1":"TownDistrict","ENGTYPE_1":"TownDistrict","CC_1":"NA","HASC_1":"IM.RU","ISO_1":"NA"}},{"id":"IMN.7_2","name":"Douglas","bounds":{"min":{"lng":-4.5288,"lat":54.1375},"max":{"lng":-4.4598,"lat":54.1839}},"geojson_properties":{"GID_1":"IMN.7_2","GID_0":"IMN","COUNTRY":"Isle of Man","NAME_1":"Douglas","VARNAME_1":"NA","NL_NAME_1":"NA","TYPE_1":"TownDistrict","ENGTYPE_1":"TownDistrict","CC_1":"NA","HASC_1":"IM.MD","ISO_1":"NA"}},{"id":"IMN.8_2","name":"Garff","bounds":{"min":{"lng":-4.4733,"lat":54.1749},"max":{"lng":-4.3064,"lat":54.3183}},"geojson_properties":{"GID_1":"IMN.8_2","GID_0":"IMN","COUNTRY":"Isle of Man","NAME_1":"Garff","VARNAME_1":"NA","NL_NAME_1":"NA","TYPE_1":"ParishDistrict","ENGTYPE_1":"ParishDistrict","CC_1":"NA","HASC_1":"IM.GR","ISO_1":"NA"}},{"id":"IMN.9_2","name":"German","bounds":{"min":{"lng":-4.7004,"lat":54.1759},"max":{"lng":-4.5501,"lat":54.2655}},"geojson_properties":{"GID_1":"IMN.9_2","GID_0":"IMN","COUNTRY":"Isle of Man","NAME_1":"German","VARNAME_1":"NA","NL_NAME_1":"NA","TYPE_1":"ParishDistrict","ENGTYPE_1":"ParishDistrict","CC_1":"NA","HASC_1":"IM.GB","ISO_1":"NA"}},{"id":"IMN.10_2","name":"Jurby","bounds":{"min":{"lng":-4.5542,"lat":54.3355},"max":{"lng":-4.4684,"lat":54.3857}},"geojson_properties":{"GID_1":"IMN.10_2","GID_0":"IMN","COUNTRY":"Isle of Man","NAME_1":"Jurby","VARNAME_1":"NA","NL_NAME_1":"NA","TYPE_1":"ParishDistrict","ENGTYPE_1":"ParishDistrict","CC_1":"NA","HASC_1":"IM.MC","ISO_1":"NA"}},{"id":"IMN.11_2","name":"Lezayre","bounds":{"min":{"lng":-4.5135,"lat":54.2415},"max":{"lng":-4.3814,"lat":54.3523}},"geojson_properties":{"GID_1":"IMN.11_2","GID_0":"IMN","COUNTRY":"Isle of Man","NAME_1":"Lezayre","VARNAME_1":"NA","NL_NAME_1":"NA","TYPE_1":"ParishDistrict","ENGTYPE_1":"ParishDistrict","CC_1":"NA","HASC_1":"IM.AY","ISO_1":"NA"}},{"id":"IMN.12_2","name":"Malew","bounds":{"min":{"lng":-4.6862,"lat":54.0537},"max":{"lng":-4.5864,"lat":54.1707}},"geojson_properties":{"GID_1":"IMN.12_2","GID_0":"IMN","COUNTRY":"Isle of Man","NAME_1":"Malew","VARNAME_1":"NA","NL_NAME_1":"NA","TYPE_1":"ParishDistrict","ENGTYPE_1":"ParishDistrict","CC_1":"NA","HASC_1":"IM.RU","ISO_1":"NA"}},{"id":"IMN.13_2","name":"Marown","bounds":{"min":{"lng":-4.6121,"lat":54.1461},"max":{"lng":-4.5251,"lat":54.2253}},"geojson_properties":{"GID_1":"IMN.13_2","GID_0":"IMN","COUNTRY":"Isle of Man","NAME_1":"Marown","VARNAME_1":"NA","NL_NAME_1":"NA","TYPE_1":"ParishDistrict","ENGTYPE_1":"ParishDistrict","CC_1":"NA","HASC_1":"IM.MD","ISO_1":"NA"}},{"id":"IMN.14_2","name":"Michael","bounds":{"min":{"lng":-4.6192,"lat":54.2329},"max":{"lng":-4.5035,"lat":54.319}},"geojson_properties":{"GID_1":"IMN.14_2","GID_0":"IMN","COUNTRY":"Isle of Man","NAME_1":"Michael","VARNAME_1":"NA","NL_NAME_1":"NA","TYPE_1":"District","ENGTYPE_1":"District","CC_1":"NA","HASC_1":"IM.MC","ISO_1":"NA"}},{"id":"IMN.15_2","name":"Onchan","bounds":{"min":{"lng":-4.5136,"lat":54.1654},"max":{"lng":-4.4208,"lat":54.2303}},"geojson_properties":{"GID_1":"IMN.15_2","GID_0":"IMN","COUNTRY":"Isle of Man","NAME_1":"Onchan","VARNAME_1":"NA","NL_NAME_1":"NA","TYPE_1":"District","ENGTYPE_1":"District","CC_1":"NA","HASC_1":"IM.MD","ISO_1":"NA"}},{"id":"IMN.16_2","name":"Patrick","bounds":{"min":{"lng":-4.7431,"lat":54.1359},"max":{"lng":-4.6035,"lat":54.2224}},"geojson_properties":{"GID_1":"IMN.16_2","GID_0":"IMN","COUNTRY":"Isle of Man","NAME_1":"Patrick","VARNAME_1":"NA","NL_NAME_1":"NA","TYPE_1":"ParishDistrict","ENGTYPE_1":"ParishDistrict","CC_1":"NA","HASC_1":"IM.GB","ISO_1":"NA"}},{"id":"IMN.17_2","name":"Peel","bounds":{"min":{"lng":-4.7058,"lat":54.2157},"max":{"lng":-4.674,"lat":54.2307}},"geojson_properties":{"GID_1":"IMN.17_2","GID_0":"IMN","COUNTRY":"Isle of Man","NAME_1":"Peel","VARNAME_1":"NA","NL_NAME_1":"NA","TYPE_1":"TownDistrict","ENGTYPE_1":"TownDistrict","CC_1":"NA","HASC_1":"IM.GB","ISO_1":"NA"}},{"id":"IMN.18_2","name":"Port Erin","bounds":{"min":{"lng":-4.7814,"lat":54.0799},"max":{"lng":-4.7469,"lat":54.1011}},"geojson_properties":{"GID_1":"IMN.18_2","GID_0":"IMN","COUNTRY":"Isle of Man","NAME_1":"Port Erin","VARNAME_1":"NA","NL_NAME_1":"NA","TYPE_1":"VillageDistrict","ENGTYPE_1":"VillageDistrict","CC_1":"NA","HASC_1":"IM.RU","ISO_1":"NA"}},{"id":"IMN.19_2","name":"Port Saint Mary","bounds":{"min":{"lng":-4.7536,"lat":54.0674},"max":{"lng":-4.7292,"lat":54.0853}},"geojson_properties":{"GID_1":"IMN.19_2","GID_0":"IMN","COUNTRY":"Isle of Man","NAME_1":"Port Saint Mary","VARNAME_1":"NA","NL_NAME_1":"NA","TYPE_1":"VillageDistrict","ENGTYPE_1":"VillageDistrict","CC_1":"NA","HASC_1":"IM.RU","ISO_1":"NA"}},{"id":"IMN.20_2","name":"Ramsey","bounds":{"min":{"lng":-4.4078,"lat":54.3131},"max":{"lng":-4.3708,"lat":54.3385}},"geojson_properties":{"GID_1":"IMN.20_2","GID_0":"IMN","COUNTRY":"Isle of Man","NAME_1":"Ramsey","VARNAME_1":"NA","NL_NAME_1":"NA","TYPE_1":"TownDistrict","ENGTYPE_1":"TownDistrict","CC_1":"NA","HASC_1":"IM.AY","ISO_1":"NA"}},{"id":"IMN.21_2","name":"Santon","bounds":{"min":{"lng":-4.604,"lat":54.0907},"max":{"lng":-4.5292,"lat":54.1507}},"geojson_properties":{"GID_1":"IMN.21_2","GID_0":"IMN","COUNTRY":"Isle of Man","NAME_1":"Santon","VARNAME_1":"NA","NL_NAME_1":"NA","TYPE_1":"ParishDistrict","ENGTYPE_1":"ParishDistrict","CC_1":"NA","HASC_1":"IM.MD","ISO_1":"NA"}}]
