[{"id":"SMR.1_1","name":"Acquaviva","bounds":{"min":{"lng":12.401,"lat":43.9302},"max":{"lng":12.4375,"lat":43.9552}},"geojson_properties":{"GID_1":"SMR.1_1","GID_0":"SMR","COUNTRY":"San Marino","NAME_1":"Acquaviva","VARNAME_1":"NA","NL_NAME_1":"NA","TYPE_1":"Castello","ENGTYPE_1":"Municipality","CC_1":"NA","HASC_1":"SM.AC","ISO_1":"NA"}},{"id":"SMR.2_1","name":"Borgo Maggiore","bounds":{"min":{"lng":12.4255,"lat":43.9182},"max":{"lng":12.4802,"lat":43.9686}},"geojson_properties":{"GID_1":"SMR.2_1","GID_0":"SMR","COUNTRY":"San Marino","NAME_1":"Borgo Maggiore","VARNAME_1":"NA","NL_NAME_1":"NA","TYPE_1":"Castello","ENGTYPE_1":"Municipality","CC_1":"NA","HASC_1":"SM.BM","ISO_1":"NA"}},{"id":"SMR.3_1","name":"Chiesanuova","bounds":{"min":{"lng":12.4056,"lat":43.8984},"max":{"lng":12.4354,"lat":43.9291}},"geojson_properties":{"GID_1":"SMR.3_1","GID_0":"SMR","COUNTRY":"San Marino","NAME_1":"Chiesanuova","VARNAME_1":"NA","NL_NAME_1":"NA","TYPE_1":"Castello","ENGTYPE_1":"Municipality","CC_1":"NA","HASC_1":"SM.CH","ISO_1":"NA"}},{"id":"SMR.4_1","name":"Domagnano","bounds":{"min":{"lng":12.456,"lat":43.9391},"max":{"lng":12.5101,"lat":43.9685}},"geojson_properties":{"GID_1":"SMR.4_1","GID_0":"SMR","COUNTRY":"San Marino","NAME_1":"Domagnano","VARNAME_1":"NA","NL_NAME_1":"NA","TYPE_1":"Castello","ENGTYPE_1":"Municipality","CC_1":"NA","HASC_1":"SM.DO","ISO_1":"NA"}},{"id":"SMR.5_1","name":"Faetano","bounds":{"min":{"lng":12.4712,"lat":43.9174},"max":{"lng":12.514,"lat":43.956}},"geojson_properties":{"GID_1":"SMR.5_1","GID_0":"SMR","COUNTRY":"San Marino","NAME_1":"Faetano","VARNAME_1":"NA","NL_NAME_1":"NA","TYPE_1":"Castello","ENGTYPE_1":"Municipality","CC_1":"NA","HASC_1":"SM.FA","ISO_1":"SM-04"}},{"id":"SMR.6_1","name":"Fiorentino","bounds":{"min":{"lng":12.4293,"lat":43.8949},"max":{"lng":12.4756,"lat":43.9241}},"geojson_properties":{"GID_1":"SMR.6_1","GID_0":"SMR","COUNTRY":"San Marino","NAME_1":"Fiorentino","VARNAME_1":"NA","NL_NAME_1":"NA","TYPE_1":"Castello","ENGTYPE_1":"Municipality","CC_1":"NA","HASC_1":"SM.FI","ISO_1":"NA"}},{"id":"SMR.7_1","name":"Montegiardino","bounds":{"min":{"lng":12.4685,"lat":43.8987},"max":{"lng":12.4938,"lat":43.9232}},"geojson_properties":{"GID_1":"SMR.7_1","GID_0":"SMR","COUNTRY":"San Marino","NAME_1":"Montegiardino","VARNAME_1":"NA","NL_NAME_1":"NA","TYPE_1":"Castello","ENGTYPE_1":"Municipality","CC_1":"NA","HASC_1":"SM.MG","ISO_1":"NA"}},{"id":"SMR.8_1","name":"San Marino","bounds":{"min":{"lng":12.4127,"lat":43.9131},"max":{"lng":12.455,"lat":43.9435}},"geojson_properties":{"GID_1":"SMR.8_1","GID_0":"SMR","COUNTRY":"San Marino","NAME_1":"San Marino","VARNAME_1":"NA","NL_NAME_1":"NA","TYPE_1":"Castello","ENGTYPE_1":"Municipality","CC_1":"NA","HASC_1":"SM.SM","ISO_1":"NA"}},{"id":"SMR.9_1","name":"Serravalle","bounds":{"min":{"lng":12.4467,"lat":43.9581},"max":{"lng":12.5131,"lat":43.9955}},"geojson_properties":{"GID_1":"SMR.9_1","GID_0":"SMR","COUNTRY":"San Marino","NAME_1":"Serravalle","VARNAME_1":"NA","NL_NAME_1":"NA","TYPE_1":"Castello","ENGTYPE_1":"Municipality","CC_1":"NA","HASC_1":"SM.SE","ISO_1":"SM-09"}}]
