[{"id":"KWT.1_1","name":"Al Ahmadi","bounds":{"min":{"lng":47.4739,"lat":28.5244},"max":{"lng":48.654,"lat":29.2663}},"geojson_properties":{"GID_1":"KWT.1_1","GID_0":"KWT","COUNTRY":"Kuwait","NAME_1":"Al Ahmadi","VARNAME_1":"NA","NL_NAME_1":"الاحمدي","TYPE_1":"Muhafazah","ENGTYPE_1":"Province","CC_1":"NA","HASC_1":"KW.AH","ISO_1":"KW-AH"}},{"id":"KWT.2_1","name":"Al Farwaniyah","bounds":{"min":{"lng":47.8417,"lat":29.185},"max":{"lng":48.0346,"lat":29.3304}},"geojson_properties":{"GID_1":"KWT.2_1","GID_0":"KWT","COUNTRY":"Kuwait","NAME_1":"Al Farwaniyah","VARNAME_1":"Farwaniya","NL_NAME_1":"الفروانية‎","TYPE_1":"Muhafazah","ENGTYPE_1":"Province","CC_1":"NA","HASC_1":"KW.FA","ISO_1":"KW-FA"}},{"id":"KWT.3_1","name":"Al Jahrah","bounds":{"min":{"lng":46.5426,"lat":28.9911},"max":{"lng":48.4432,"lat":30.0839}},"geojson_properties":{"GID_1":"KWT.3_1","GID_0":"KWT","COUNTRY":"Kuwait","NAME_1":"Al Jahrah","VARNAME_1":"Jahra","NL_NAME_1":"الجهراء","TYPE_1":"Muhafazah","ENGTYPE_1":"Province","CC_1":"NA","HASC_1":"KW.JA","ISO_1":"NA"}},{"id":"KWT.4_1","name":"Al Kuwayt","bounds":{"min":{"lng":47.8596,"lat":29.31},"max":{"lng":48.0108,"lat":29.3935}},"geojson_properties":{"GID_1":"KWT.4_1","GID_0":"KWT","COUNTRY":"Kuwait","NAME_1":"Al Kuwayt","VARNAME_1":"AlAsimah,Capital,Kuwait","NL_NAME_1":"العاصمه","TYPE_1":"Muhafazah","ENGTYPE_1":"Province","CC_1":"NA","HASC_1":"KW.KU","ISO_1":"NA"}},{"id":"KWT.5_1","name":"Hawalli","bounds":{"min":{"lng":47.9797,"lat":29.3023},"max":{"lng":48.1018,"lat":29.3707}},"geojson_properties":{"GID_1":"KWT.5_1","GID_0":"KWT","COUNTRY":"Kuwait","NAME_1":"Hawalli","VARNAME_1":"Hawali,Howali","NL_NAME_1":"حولي","TYPE_1":"Muhafazah","ENGTYPE_1":"Province","CC_1":"NA","HASC_1":"KW.HW","ISO_1":"KW-HA"}},{"id":"KWT.6_1","name":"Mubarak Al-Kabeer","bounds":{"min":{"lng":48.004,"lat":29.2087},"max":{"lng":48.1074,"lat":29.3051}},"geojson_properties":{"GID_1":"KWT.6_1","GID_0":"KWT","COUNTRY":"Kuwait","NAME_1":"Mubarak Al-Kabeer","VARNAME_1":"NA","NL_NAME_1":"مباركالكبير","TYPE_1":"Muhafazah","ENGTYPE_1":"Province","CC_1":"NA","HASC_1":"KW.MU","ISO_1":"NA"}}]
