[{"id":"WLF.1_1","name":"Alo","bounds":{"min":{"lng":-178.1592,"lat":-14.3691},"max":{"lng":-177.9986,"lat":-14.2456}},"geojson_properties":{"GID_1":"WLF.1_1","GID_0":"WLF","COUNTRY":"Wallis and Futuna","NAME_1":"Alo","VARNAME_1":"NA","NL_NAME_1":"NA","TYPE_1":"Kingdom","ENGTYPE_1":"Kingdom","CC_1":"NA","HASC_1":"WF.AL","ISO_1":"NA"}},{"id":"WLF.2_1","name":"Singave","bounds":{"min":{"lng":-178.1825,"lat":-14.3282},"max":{"lng":-178.1344,"lat":-14.2389}},"geojson_properties":{"GID_1":"WLF.2_1","GID_0":"WLF","COUNTRY":"Wallis and Futuna","NAME_1":"Singave","VARNAME_1":"Sigave","NL_NAME_1":"NA","TYPE_1":"Kingdom","ENGTYPE_1":"Kingdom","CC_1":"NA","HASC_1":"WF.SI","ISO_1":"NA"}},{"id":"WLF.3_1","name":"Uvéa","bounds":{"min":{"lng":-176.2511,"lat":-13.3922},"max":{"lng":-176.1247,"lat":-13.1828}},"geojson_properties":{"GID_1":"WLF.3_1","GID_0":"WLF","COUNTRY":"Wallis and Futuna","NAME_1":"Uvéa","VARNAME_1":"MataUtu","NL_NAME_1":"NA","TYPE_1":"Kingdom","ENGTYPE_1":"Kingdom","CC_1":"NA","HASC_1":"WF.UV","ISO_1":"NA"}}]
