[{"id":"MAR.1_1","name":"Chaouia - Ouardigha","bounds":{"min":{"lng":-8.1232,"lat":32.3493},"max":{"lng":-5.9999,"lat":33.8304}},"geojson_properties":{"GID_1":"MAR.1_1","GID_0":"MAR","COUNTRY":"Morocco","NAME_1":"Chaouia - Ouardigha","VARNAME_1":"NA","NL_NAME_1":"NA","TYPE_1":"Region","ENGTYPE_1":"Region","CC_1":"NA","HASC_1":"MA.CO","ISO_1":"NA"}},{"id":"MAR.2_1","name":"Doukkala - Abda","bounds":{"min":{"lng":-9.4354,"lat":31.6938},"max":{"lng":-7.9324,"lat":33.4585}},"geojson_properties":{"GID_1":"MAR.2_1","GID_0":"MAR","COUNTRY":"Morocco","NAME_1":"Doukkala - Abda","VARNAME_1":"NA","NL_NAME_1":"NA","TYPE_1":"Region","ENGTYPE_1":"Region","CC_1":"NA","HASC_1":"MA.DA","ISO_1":"NA"}},{"id":"MAR.3_1","name":"Fès - Boulemane","bounds":{"min":{"lng":-5.4336,"lat":32.6238},"max":{"lng":-2.9691,"lat":34.3254}},"geojson_properties":{"GID_1":"MAR.3_1","GID_0":"MAR","COUNTRY":"Morocco","NAME_1":"Fès - Boulemane","VARNAME_1":"NA","NL_NAME_1":"NA","TYPE_1":"Region","ENGTYPE_1":"Region","CC_1":"NA","HASC_1":"MA.FB","ISO_1":"NA"}},{"id":"MAR.4_1","name":"Gharb - Chrarda - Béni Hssen","bounds":{"min":{"lng":-6.7118,"lat":34.0956},"max":{"lng":-5.1467,"lat":34.988}},"geojson_properties":{"GID_1":"MAR.4_1","GID_0":"MAR","COUNTRY":"Morocco","NAME_1":"Gharb - Chrarda - Béni Hssen","VARNAME_1":"NA","NL_NAME_1":"NA","TYPE_1":"Region","ENGTYPE_1":"Region","CC_1":"NA","HASC_1":"MA.GB","ISO_1":"NA"}},{"id":"MAR.5_1","name":"Grand Casablanca","bounds":{"min":{"lng":-7.8949,"lat":33.3194},"max":{"lng":-7.3456,"lat":33.7343}},"geojson_properties":{"GID_1":"MAR.5_1","GID_0":"MAR","COUNTRY":"Morocco","NAME_1":"Grand Casablanca","VARNAME_1":"NA","NL_NAME_1":"NA","TYPE_1":"Region","ENGTYPE_1":"Region","CC_1":"NA","HASC_1":"MA.GC","ISO_1":"NA"}},{"id":"MAR.6_1","name":"Guelmim - Es-Semara","bounds":{"min":{"lng":-11.7752,"lat":27.6701},"max":{"lng":-6.3745,"lat":30.4125}},"geojson_properties":{"GID_1":"MAR.6_1","GID_0":"MAR","COUNTRY":"Morocco","NAME_1":"Guelmim - Es-Semara","VARNAME_1":"NA","NL_NAME_1":"NA","TYPE_1":"Region","ENGTYPE_1":"Region","CC_1":"NA","HASC_1":"MA.GE","ISO_1":"NA"}},{"id":"MAR.7_1","name":"Laâyoune - Boujdour - Sakia El H","bounds":{"min":{"lng":-13.1679,"lat":27.6785},"max":{"lng":-11.4789,"lat":28.2151}},"geojson_properties":{"GID_1":"MAR.7_1","GID_0":"MAR","COUNTRY":"Morocco","NAME_1":"Laâyoune - Boujdour - Sakia El H","VARNAME_1":"NA","NL_NAME_1":"NA","TYPE_1":"Region","ENGTYPE_1":"Region","CC_1":"NA","HASC_1":"MA.LB","ISO_1":"NA"}},{"id":"MAR.8_1","name":"Marrakech - Tensift - Al Haouz","bounds":{"min":{"lng":-9.8424,"lat":30.8092},"max":{"lng":-6.9757,"lat":32.8157}},"geojson_properties":{"GID_1":"MAR.8_1","GID_0":"MAR","COUNTRY":"Morocco","NAME_1":"Marrakech - Tensift - Al Haouz","VARNAME_1":"NA","NL_NAME_1":"NA","TYPE_1":"Region","ENGTYPE_1":"Region","CC_1":"NA","HASC_1":"MA.MK","ISO_1":"NA"}},{"id":"MAR.9_1","name":"Meknès - Tafilalet","bounds":{"min":{"lng":-6.3978,"lat":30.0061},"max":{"lng":-3.244,"lat":34.268}},"geojson_properties":{"GID_1":"MAR.9_1","GID_0":"MAR","COUNTRY":"Morocco","NAME_1":"Meknès - Tafilalet","VARNAME_1":"NA","NL_NAME_1":"NA","TYPE_1":"Region","ENGTYPE_1":"Region","CC_1":"NA","HASC_1":"MA.MT","ISO_1":"NA"}},{"id":"MAR.10_1","name":"Oriental","bounds":{"min":{"lng":-4.0591,"lat":31.7097},"max":{"lng":-0.9963,"lat":35.4401}},"geojson_properties":{"GID_1":"MAR.10_1","GID_0":"MAR","COUNTRY":"Morocco","NAME_1":"Oriental","VARNAME_1":"NA","NL_NAME_1":"NA","TYPE_1":"Region","ENGTYPE_1":"Region","CC_1":"NA","HASC_1":"MA.OR","ISO_1":"NA"}},{"id":"MAR.11_1","name":"Rabat - Salé - Zemmour - Zaer","bounds":{"min":{"lng":-7.1268,"lat":33.1421},"max":{"lng":-5.7447,"lat":34.1874}},"geojson_properties":{"GID_1":"MAR.11_1","GID_0":"MAR","COUNTRY":"Morocco","NAME_1":"Rabat - Salé - Zemmour - Zaer","VARNAME_1":"NA","NL_NAME_1":"NA","TYPE_1":"Region","ENGTYPE_1":"Region","CC_1":"NA","HASC_1":"MA.RZ","ISO_1":"NA"}},{"id":"MAR.12_1","name":"Souss - Massa - Draâ","bounds":{"min":{"lng":-10.4396,"lat":29.0319},"max":{"lng":-5.1176,"lat":32.0342}},"geojson_properties":{"GID_1":"MAR.12_1","GID_0":"MAR","COUNTRY":"Morocco","NAME_1":"Souss - Massa - Draâ","VARNAME_1":"NA","NL_NAME_1":"NA","TYPE_1":"Region","ENGTYPE_1":"Region","CC_1":"NA","HASC_1":"MA.SM","ISO_1":"NA"}},{"id":"MAR.13_1","name":"Tadla - Azilal","bounds":{"min":{"lng":-7.2664,"lat":31.3566},"max":{"lng":-5.5007,"lat":32.7654}},"geojson_properties":{"GID_1":"MAR.13_1","GID_0":"MAR","COUNTRY":"Morocco","NAME_1":"Tadla - Azilal","VARNAME_1":"NA","NL_NAME_1":"NA","TYPE_1":"Region","ENGTYPE_1":"Region","CC_1":"NA","HASC_1":"MA.TD","ISO_1":"NA"}},{"id":"MAR.14_1","name":"Tanger - Tétouan","bounds":{"min":{"lng":-6.2501,"lat":34.7146},"max":{"lng":-4.4526,"lat":35.9226}},"geojson_properties":{"GID_1":"MAR.14_1","GID_0":"MAR","COUNTRY":"Morocco","NAME_1":"Tanger - Tétouan","VARNAME_1":"NA","NL_NAME_1":"NA","TYPE_1":"Region","ENGTYPE_1":"Region","CC_1":"NA","HASC_1":"MA.TO","ISO_1":"NA"}},{"id":"MAR.15_1","name":"Taza - Al Hoceima - Taounate","bounds":{"min":{"lng":-5.4888,"lat":33.5694},"max":{"lng":-2.9459,"lat":35.2621}},"geojson_properties":{"GID_1":"MAR.15_1","GID_0":"MAR","COUNTRY":"Morocco","NAME_1":"Taza - Al Hoceima - Taounate","VARNAME_1":"NA","NL_NAME_1":"NA","TYPE_1":"Region","ENGTYPE_1":"Region","CC_1":"NA","HASC_1":"MA.TH","ISO_1":"NA"}}]
