[{"id":"GRC.1_1","name":"Aegean","bounds":{"min":{"lng":24.0999,"lat":35.3387},"max":{"lng":29.6457,"lat":40.0368}},"geojson_properties":{"GID_1":"GRC.1_1","GID_0":"GRC","COUNTRY":"Greece","NAME_1":"Aegean","VARNAME_1":"NA","NL_NAME_1":"Αιγαίο","TYPE_1":"Apokentroménesdioikíseis","ENGTYPE_1":"Decentralizedadministration","CC_1":"NA","HASC_1":"GR.AI","ISO_1":"NA"}},{"id":"GRC.2_1","name":"Athos","bounds":{"min":{"lng":23.9926,"lat":40.114},"max":{"lng":24.3996,"lat":40.4543}},"geojson_properties":{"GID_1":"GRC.2_1","GID_0":"GRC","COUNTRY":"Greece","NAME_1":"Athos","VARNAME_1":"NA","NL_NAME_1":"Άθως","TYPE_1":"Apokentroménesdioikíseis","ENGTYPE_1":"Decentralizedadministration","CC_1":"NA","HASC_1":"GR.MA","ISO_1":"NA"}},{"id":"GRC.3_1","name":"Attica","bounds":{"min":{"lng":22.8915,"lat":35.8218},"max":{"lng":24.1051,"lat":38.3413}},"geojson_properties":{"GID_1":"GRC.3_1","GID_0":"GRC","COUNTRY":"Greece","NAME_1":"Attica","VARNAME_1":"NA","NL_NAME_1":"Αττική","TYPE_1":"Apokentroménesdioikíseis","ENGTYPE_1":"Decentralizedadministration","CC_1":"NA","HASC_1":"GR.AT","ISO_1":"NA"}},{"id":"GRC.4_1","name":"Crete","bounds":{"min":{"lng":23.4735,"lat":34.8007},"max":{"lng":26.3535,"lat":35.696}},"geojson_properties":{"GID_1":"GRC.4_1","GID_0":"GRC","COUNTRY":"Greece","NAME_1":"Crete","VARNAME_1":"NA","NL_NAME_1":"Κρήτη","TYPE_1":"Apokentroménesdioikíseis","ENGTYPE_1":"Decentralizedadministration","CC_1":"NA","HASC_1":"GR.CR","ISO_1":"NA"}},{"id":"GRC.5_1","name":"Epirus and Western Macedonia","bounds":{"min":{"lng":20.0072,"lat":38.9446},"max":{"lng":22.1936,"lat":40.9548}},"geojson_properties":{"GID_1":"GRC.5_1","GID_0":"GRC","COUNTRY":"Greece","NAME_1":"Epirus and Western Macedonia","VARNAME_1":"NA","NL_NAME_1":"ΉπειροςκαιΔυτικήΜακεδονία","TYPE_1":"Apokentroménesdioikíseis","ENGTYPE_1":"Decentralizedadministration","CC_1":"NA","HASC_1":"GR.EM","ISO_1":"NA"}},{"id":"GRC.6_1","name":"Macedonia and Thrace","bounds":{"min":{"lng":21.7025,"lat":39.9076},"max":{"lng":26.6418,"lat":41.748}},"geojson_properties":{"GID_1":"GRC.6_1","GID_0":"GRC","COUNTRY":"Greece","NAME_1":"Macedonia and Thrace","VARNAME_1":"NA","NL_NAME_1":"ΜακεδονίακαιΘράκη","TYPE_1":"Apokentroménesdioikíseis","ENGTYPE_1":"Decentralizedadministration","CC_1":"NA","HASC_1":"GR.MH","ISO_1":"NA"}},{"id":"GRC.7_1","name":"Peloponnese, Western Greece and","bounds":{"min":{"lng":19.3724,"lat":36.3851},"max":{"lng":23.4529,"lat":39.899}},"geojson_properties":{"GID_1":"GRC.7_1","GID_0":"GRC","COUNTRY":"Greece","NAME_1":"Peloponnese, Western Greece and","VARNAME_1":"NA","NL_NAME_1":"Πελοπόννησος,ΔυτικήΕλλάδακαι","TYPE_1":"Apokentroménesdioikíseis","ENGTYPE_1":"Decentralizedadministration","CC_1":"NA","HASC_1":"GR.PW","ISO_1":"NA"}},{"id":"GRC.8_1","name":"Thessaly and Central Greece","bounds":{"min":{"lng":21.1188,"lat":37.9304},"max":{"lng":24.6863,"lat":40.194}},"geojson_properties":{"GID_1":"GRC.8_1","GID_0":"GRC","COUNTRY":"Greece","NAME_1":"Thessaly and Central Greece","VARNAME_1":"NA","NL_NAME_1":"ΘεσσαλίακαιΣτερεάΕλλάδα","TYPE_1":"Apokentroménesdioikíseis","ENGTYPE_1":"Decentralizedadministration","CC_1":"NA","HASC_1":"GR.TC","ISO_1":"NA"}}]
